title,lyrics,이별유무,긍부정,cluster_label
Dreaming About You,시간을맴돌아 멈춰선 자리.이끌리듯이나 그대를 찾아요.보이지않는 저 너머에서도.우리는 서로를 알아볼까요.너를 기다린다시간이흘러 운명처럼 맞닿는.그 순간 기다려요.당신에 대한 꿈.오늘도 당신을 그대꿈을 꾸죠.잠시라도떨어지고 싶지 않아.당신에 대한 꿈.오늘도 당신을 그댈찾아 잠들죠.들리나요 나의 목소리.주위를맴돌아 서성인 자리.이끌리듯이나 그대를 찾아요.환하게 비추는 저별을 따라서.만나게 될까 우리걷다 보면.너를 기다린다시간이흘러 운명처럼 마주친.이 순간 기억해요.당신에 대한 꿈.오늘도 당신을 그대꿈을 꾸죠.잠시라도깨어나고 싶지 않아.당신에 대한 꿈.오늘도 당신을 그댈찾아 잠들죠.들리나요. 너는 꿈꾸는.내일도 당신을 그대꿈을 꾸죠.한시라도떨어지고 싶지 않아.당신에 대한 꿈.오늘도 당신을 그대곁에 잠들죠.들리나요 나의 목소리,0,1,
Like A Star,당신 옆에서 눈을 감으면. 나의 마음 속에서 느껴지네요. 계속 만져춰요. 너의 마음을 보내줘 사랑해. 포근히 나를 감싸와 행복하게 해. 별처럼. 내 사랑이 보이니. 바람처러 내 마음 속에 들어와. 눈 속에 반짝이는 듯. 별처럼 마음에 있죠. 그대를 만나고 난 후. 모든 것이 바뀌어만 가죠. 계속 만져줘. 너의 마음을 보내줘 사랑해. 내 맘이 그대만 찾죠 사랑하니까. 별처럼. 내 사랑이 보이니. 바람처럼 내 마음 속에 들어와. 눈 속에 반짝이는 듯. 별처럼 마음에 있죠.,0,1,
우리의 방식,서둘러 시간이 흘러. 내 손을 잡아. 보드라운 곳이든 아니든. 너와 가겠어. 이곳을 벗어나. 가장 낯선 곳으로 가보기로 해. 오늘을 오늘답게. 찰나의 순간들을 나와 함께해. 그래 그렇게 너와 나. 세상의 테두리 안에. 갇혀 지내 잊고 있던. 사랑하는 수많은 방식들을 알잖아. 이 시간을 잘게 잘게 나눠서. 내일이 없는 것처럼. 가장 우리다운 방식대로 해. 그 방식대로 해. 나를 믿어 난 널 믿을게. 이 손 놓지 마. 불안하게 아름답게. 헝클어지자. 네가 괜찮다면 나도 괜찮아. 난 우리가 무모해질 때를 기억해. 숨이 가득 찰 때. 같은 길을 달릴 때. 우린 더욱 빛나. 그래 그렇게 너와 나. 세상의 테두리 안에. 갇혀 지내 잊고 있던. 사랑하는 수많은 방식들을 알잖아. 용감했던 그 눈빛을 기억해. 내 모든 걸 다 잃어도. 가장 우리다운 방식대로 해. 우리 방식대로 해. 우리 방식대로. 그 방식대로. 우리 방식대로,0,1,
꽃말,나의 작은 방에. 은은하게 퍼진. 이제 막 피어난. 달콤한 향기. 어떤 말을 내게. 하고 싶은 걸까. 나 너에게. 마음을 열어도 될까. 이름은 알아도. 불려지는 의미를 아직은 모르는. 이 꽃을. 잘 보이는 곳에. 예쁘게 꽂아 놓을게. 널 생각하면서. 매일매일 바라볼게. 꽃들 사이 간격처럼. 닿을 듯 말 듯 해 우리 둘. 기다릴게. 우린 알고 있잖아. 싱그럽던 마음도. 시들어 버리는 게 슬퍼서. 이젠 주는 것도 받는 것도 쉽지가 않아. 내게 커다란 신호였어 그 꽃에 담긴. 네 마음이. 그 마음이. 잘 보이는 곳에. 예쁘게 꽂아 놓을게. 널 생각하면서. 매일매일 바라볼게. 꽃들 사이 간격처럼. 닿을 듯 말 듯 해 우리 둘. 기다릴게. 괜히 꽃잎을 만지작거려. 안녕 너의 꽃말이 궁금해. 궁금하지만 찾아보진 않을게. 네가 와서 알려줘. 멀지 않은 곳에. 다정히 기다릴게. 나도 조금씩 더 다가갈게. 적당한 온도와 바람. 날 좋은 날 어쩌면. 약속하게 될까. 우리,0,1,
You already have,벌써 했다.맘을 가졌는걸 내넌 이미.난 이미 죽은 목숨이다.난 네 사랑이 될 수 없는걸.내게처음 다가왔을 때. 커다랗게웃어주었을 때.벌써 했다.너는이미 나를 가졌는걸.벌써 했다.가지고 있잖아 걸넌 많은.난 이미 알아.네 옆에 선 난 너무 초라해.네게어울리지 않는 나. 너무 아픈사랑이 될 거야.난 이미 죽은 목숨이다.어차피 넌 다모를 테니까.나는오늘도 사랑하지 않으려.나는 눈을 감으면 내 눈을 감습니다.나를 던져 사랑할것만 같아. 널 싫어해 널 미워해 널 좋아해.널 싫어해 널 미워해 널 좋아해.널 싫어해 널 싫어해 널 싫어해.널 사랑해. 나는 이미 가지고 있다.너의미소 눈빛 하나하나.나는 이미 가지고 있다.모두 내 안에 숨 쉬고 있어,0,1,
오늘도 난 봄을 기다려,어느 순간부터 네 행동 하나에도. 내 기분이 달라지곤 해. 내겐 소중한 이 마음이. 별게 아닐까 봐서. 혼자 자꾸 숨기게 돼요. 서로가 서롤 알아보고. 같은 맘을 갖는 게. 얼마나 어려운지. 매일이 봄일 수는 없겠지만. 오늘도 난 봄을 기다려. 그날을 꿈꿔요 함께할 그날을. 작은 우연에도 의미를 담아 넣고. 나 혼자 사랑을 연습하곤 해. 네게 유일한 그 사람이. 내가 될 수 있을까. 수백 번 내 맘 다잡아요. 서로가 서롤 알아보고. 같은 맘을 갖는 게. 얼마나 어려운지. 매일이 봄일 수는 없겠지만. 오늘도 난 봄을 기다려. 그날을 꿈꿔요 함께할 그날을. 그대도 내 맘과 같기를. 혼자서 끝나버릴 사랑인데. 헛된 꿈을 꾸는 걸까 봐. 자꾸 겁이 나요 커지는 내 맘이. 언젠가는 봄이 오겠죠. 그날만을 기다릴게요,0,1,
오늘도 난 봄을 기다려 (Inst.),어느 순간부터 네 행동 하나에도. 내 기분이 달라지곤 해. 내겐 소중한 이 마음이. 별게 아닐까 봐서. 혼자 자꾸 숨기게 돼요. 서로가 서롤 알아보고. 같은 맘을 갖는 게. 얼마나 어려운지. 매일이 봄일 수는 없겠지만. 오늘도 난 봄을 기다려. 그날을 꿈꿔요 함께할 그날을. 작은 우연에도 의미를 담아 넣고. 나 혼자 사랑을 연습하곤 해. 네게 유일한 그 사람이. 내가 될 수 있을까. 수백 번 내 맘 다잡아요. 서로가 서롤 알아보고. 같은 맘을 갖는 게. 얼마나 어려운지. 매일이 봄일 수는 없겠지만. 오늘도 난 봄을 기다려. 그날을 꿈꿔요 함께할 그날을. 그대도 내 맘과 같기를. 혼자서 끝나버릴 사랑인데. 헛된 꿈을 꾸는 걸까 봐. 자꾸 겁이 나요 커지는 내 맘이. 언젠가는 봄이 오겠죠. 그날만을 기다릴게요,0,1,
좋아해.. (바른연애 길잡이 X 죠지),용기 내어보려 노력했는데. 왜 네 앞에서는 다 어색해지고. 꽤 자연스럽던 내 인사마저도. 마음대로 되지가 않아. 그저 웃어주는 널 바라보면. 아무 이유 없이 행복해져. 늘 서툴렀었던 내 못난 표현에도. 따뜻하게 안아주었어. 널 좋아한다 말하고. 집에 돌아가는 길에. 너의 얼굴이 자꾸 떠올라. 나도 몰래 설레였어. 누구보다 널 위해 많이 노력하고 있어. 뒤돌아보면 언제나 그랬듯. 서있을 거야. 우리 잠시라도 마주칠 때면. 괜히 너의 눈을 피하게 돼. 잘 몰랐었던 너의 작은 오해에도. 하루 종일 고민했었어. 널 좋아한다 말하고 집에 돌아가는 길에. 너의 얼굴이 자꾸 떠올라. 나도 몰래 설레였어. 누구보다 널 위해 많이 노력하고 있어. 뒤돌아보면 언제나 그랬듯. 서있을 거야. 아마도 많이 달라졌었겠지. 네가 없었다면 나는 지금 어땠을까. 우리 조금 달랐을까. 좋아한다 말하고 집에 돌아가는 길에. 너의 얼굴이 자꾸 떠올라. 나도 몰래 설레였어. 누구보다 널 위해 많이 노력하고 있어. 뒤돌아보면 언제나 그랬듯. 서있을 거야,0,1,
좋아해.. (바른연애 길잡이 X 죠지) (Inst.),용기 내어보려 노력했는데. 왜 네 앞에서는 다 어색해지고. 꽤 자연스럽던 내 인사마저도. 마음대로 되지가 않아. 그저 웃어주는 널 바라보면. 아무 이유 없이 행복해져. 늘 서툴렀었던 내 못난 표현에도. 따뜻하게 안아주었어. 널 좋아한다 말하고. 집에 돌아가는 길에. 너의 얼굴이 자꾸 떠올라. 나도 몰래 설레였어. 누구보다 널 위해 많이 노력하고 있어. 뒤돌아보면 언제나 그랬듯. 서있을 거야. 우리 잠시라도 마주칠 때면. 괜히 너의 눈을 피하게 돼. 잘 몰랐었던 너의 작은 오해에도. 하루 종일 고민했었어. 널 좋아한다 말하고 집에 돌아가는 길에. 너의 얼굴이 자꾸 떠올라. 나도 몰래 설레였어. 누구보다 널 위해 많이 노력하고 있어. 뒤돌아보면 언제나 그랬듯. 서있을 거야. 아마도 많이 달라졌었겠지. 네가 없었다면 나는 지금 어땠을까. 우리 조금 달랐을까. 좋아한다 말하고 집에 돌아가는 길에. 너의 얼굴이 자꾸 떠올라. 나도 몰래 설레였어. 누구보다 널 위해 많이 노력하고 있어. 뒤돌아보면 언제나 그랬듯. 서있을 거야,0,1,
이렇게 좋나요 (feat. DJ Deborah),"메말랐던 나의 심장.심하게 나버린 고장.고치기도 귀찮아.아무렇지않은척그냥 지냈던 날들.어 운명처럼 나타나.니가내 앞에 나타나.모래만날리던 사막 가운데.넌마치 한줄기 비처럼.불을지펴 소방 타오르게해 다시.물들여져 소방 붉게 다시.차갑게바람불면 나를 감싸줄.너의 사랑이 있어난 포근해.너를 사랑해 다해서내 마음을.약속할게 난 약속 u. 이제 시작해 우리사랑 지금부터 ing.차가운 바람이 불었던.햇살이 가득하죠 이제는내 맘에.닫혀있던맘이 이젠 피어나죠.그대를 만나 내모든게 바꼈죠.어떻게 이렇게 좋나요.그대에게내가 소중한 사람될거에요.라라라라기분 좋아 라라라라.이런느낌 너무 오랫만이야.이렇게 설레게 할일이야, 제가 어 그것을 너무나도 사랑합니다.모두 다 즐겨줄게, 제가 어, 사랑하죠. 넌나의 에너지를 사랑한다.핑크빛 사랑으로 채워.따스한 햇살처럼 비춰.다가와다가와 남자 운명이다.밀려와밀려와 너란 파도.어둠은 사라져. 난 우주를너에게줄게 심장이다.외롭던 내 세상에.그대가 감싸주는 오로라.차가운 바람이 불었던내 맘에.이제는 햇살이 가득하죠.닫혀있던맘이 이젠 피어나죠.그대를 만나 내모든게 바꼈죠.어떻게 이렇게 좋나요.그대에게 내가.소중한 사람될거에요",0,1,
이렇게 좋나요 (inst.),"메말랐던 나의 심장.심하게 나버린 고장.고치기도 귀찮아.아무렇지않은척그냥 지냈던 날들.어 운명처럼 나타나.니가내 앞에 나타나.모래만날리던 사막 가운데.넌마치 한줄기 비처럼.불을지펴 소방 타오르게해 다시.물들여져 소방 붉게 다시.차갑게바람불면 나를 감싸줄.너의 사랑이 있어난 포근해.너를 사랑해 다해서내 마음을.약속할게 난 약속 u. 이제 시작해 우리사랑 지금부터 ing.차가운 바람이 불었던.햇살이 가득하죠 이제는내 맘에.닫혀있던맘이 이젠 피어나죠.그대를 만나 내모든게 바꼈죠.어떻게 이렇게 좋나요.그대에게내가 소중한 사람될거에요.라라라라기분 좋아 라라라라.이런느낌 너무 오랫만이야.이렇게 설레게 할일이야, 제가 어 그것을 너무나도 사랑합니다.모두 다 즐겨줄게, 제가 어, 사랑하죠. 넌나의 에너지를 사랑한다.핑크빛 사랑으로 채워.따스한 햇살처럼 비춰.다가와다가와 남자 운명이다.밀려와밀려와 너란 파도.어둠은 사라져. 난 우주를너에게줄게 심장이다.외롭던 내 세상에.그대가 감싸주는 오로라.차가운 바람이 불었던내 맘에.이제는 햇살이 가득하죠.닫혀있던맘이 이젠 피어나죠.그대를 만나 내모든게 바꼈죠.어떻게 이렇게 좋나요.그대에게 내가.소중한 사람될거에요",0,1,
좋아서 그래,어설픈 나의 말투.표현 해도 척관심 없는.사랑스러운 말로.받아주는 너 때문에.미소가 새어 나오네.난 그걸 모른다.몰라.맘에도 없는 말을뱉곤 해. 네가 좋아서그래 넌 알고있을까.까칠한말투와 행동들 다. 하나부터 열까지모른 척 하지만.자꾸 자꾸. 왜 자꾸머릴 맴도는 걸까.허전했던 내 맘도내 맘도.채워지는 너 때문에.점점 더 따뜻해지네.난 그걸 모른다.몰라.나도 모르던 내 맘을 알게 해 아기.네가 좋아서 그래넌 알고있을까.까칠한말투와 행동들 다. 하나부터 열까지모른 척 하지만.자꾸 자꾸. 왜 자꾸머릴 맴도는 걸까.하나 둘 되뇌어봐도.맘처럼 쉽지가 않잖아.서툴기만 한 10살 아이처럼.바라봐줄 순 없을까.그냥 너를 사랑해 다 알고 있잖아.사소한말투와 행동들 넌. 처음부터 끝까지모른 척 했지만.전부 전부. 알고도 모른척 해 준거야.우. 라라라라라랄라.우. 전부 전부.알고도모른 척 했던거야.네가 좋아서 그래. 넌 알고있을까.까칠한 말투와 행동들 다,0,1,
그런 바보 (Feat. eldon),어딜 봐 나 지금 얘기하잖아. 넌 자꾸 딴 생각만. 하고 있는 것 같애. 거짓말 방금도 딴 곳만 쳐다봤잖아. 왜 자꾸 안달 나게 해. 아니라고. 나만 봤다고. 그렇게 얘기를 하면서. 질투하는 내가 귀엽다며. 넌 기분이 좋은가봐. 이것 봐 또 이렇게 될 걸 알면서. 난 스르르 녹아내려. 바보야 난 너 밖에 모르는 그런. 너의 바보가 맞나봐. 아닌 척 해봐도. 어쩔 수 없나봐. 어쩌면 나도. 이런 내가 정말로 이상한. 질투도 많고. 주책도 맞은. 그런 바보. 그런 바보. 그런 바보. 널 바라볼 때면. 어쩜 이렇게 사랑스러울까. 생각에 빠지곤 해. 가끔 서운한 모습도 귀여워. 괜히 장난치고 싶었어. 내 눈 속엔 생각 속엔. 항상 네 자리뿐였던 걸. 떠올리면 벅차오를 만큼. 너 하나만 가득한 걸. 말 안 해도 내 맘 느껴질 수 있게. 꼭 안아보게 이리 와. 바보야 난 너 밖에 모르는 그런. 너의 바보가 맞나봐. 아닌 척 해봐도. 어쩔 수 없나봐. 어쩌면 나도. 이런 내가 정말로 이상한. 질투도 많고. 주책도 맞은. 그런 바보. 그런 바보. 그런 바보. 너와 함께라면. 행복하지 않을 이유는. 하나도 없는 걸. 너만 담기에도. 모자란 지금이란 걸 알아. 바보야 난 너 밖에 모르는 그런. 너의 바보가 맞나봐. 아닌 척 해봐도. 어쩔 수 없나봐. 어쩌면 나도. 이런 내가 정말로 이상한. 질투도 많고. 주책도 맞은. 그런 바보. 그런 바보. 그런 바보,0,1,
오래된 커플,우리도 저 언니오빠들처럼. 함께한 시간이 모여. 오래된 커플이 되어있겠지. 우리도 그 언젠가. 그때쯤이면 난 지금보다 좀 더. 나의 너를 아는 내가 되어있겠지. 시간이 흘러. 나이를 먹는 건 참 싫지만. 우리의 추억거리가 느는 게 참 좋다. 너에게 해주고 싶었던 말이 있어. 오래오래 내 곁에서 놀아줘. 많은 건 안 바랄게. 그냥 내 곁에만 있어. 아무 말 안 해도. 아무 말이나 해도. 다 재밌는 지금처럼. 그때쯤이면 난 지금보다 좀 더. 많은 노래를 너에게 선물했겠지. 우리 이야기가. 세상에 울려 퍼질 때쯤. 그땐 널 더 오래. 안을 수 있음 좋겠다. 너에게 해주고 싶었던 말이 있어. 오래오래 내 곁에서 놀아줘. 많은 건 안 바랄게. 그냥 내 곁에만 있어. 아무 말 안 해도. 아무 말이나 해도. 다 재밌는 지금처럼. 우리만 아는 유행어. 우리만 아는 웃음소리. 사랑해라고 속삭일 땐. 우리만 아는 그 멜로디. 사진 찍을 땐 너가 나를. 따라하는 그 표정까지. 너와 내가 만들어가는. 모든 것이 다 좋아. 너에게 해주고 싶었던 말이 있어. 오래오래 내 곁에서 놀아줘. 많은 건 안 바랄게. 그냥 내 곁에만 있어. 아무 말 안 해도. 아무 말이나 해도. 다 재밌는 지금처럼,0,1,
헤어지지말자,어쩌면 너와. 함께하는 이 순간들이. 깨지진 않을까 두려워 나. 나도 사랑받을 수 있을까. 그렇게 생각했던 나니까. 널 잃고 싶진 않은데. 아무 생각 없이. 함께 듣던 이별 노래가. 사실은 너무 아프게 다가와. 그게 내가 되지는 않을까. 그렇게 생각하게 되니까. 우린 절대로 헤어지지말자. 누구에게도 해본 적 없는 말이지만. 어떤 상황이 와도 널 잡을게. 함께 하고 싶어 매 순간에. 우린 헤어지지말자. 난 불행해질 자신이 없어. 널 잃고선 행복할 자신 없어. 약속하겠다는 말도 않고. 떠나지 않겠단 말도. 너가 나의 곁에 있다는 게. 자연스러운 일이 돼버렸는데. 그게 아님 어떻게 해야 해. 우린 절대로 헤어지지말자. 누구에게도 해본 적 없는 말이지만. 어떤 상황이 와도 널 잡을게. 함께 하고 싶어 매 순간에. 우린 절대로,0,1,
약속,우리 이렇게 애틋한 지금이. 그리워지는 날이 올까. 그런 날이 온다면. 그땐 널 내 품에 안고서. 잠들 수 있는 날이면 좋겠어. 많이 안을 수 있으면. 내 품을 좋아하는 너이니까. 나는 너의 약속이 되고 싶어. 혹시 지키지 못할까봐. 두려워해도 좋아. 곁에 있으니. 나는 너의 웃음을 닮고 싶어. 세상의 모든 걱정을. 잊게 하는. 너의 웃음을. 우리 이렇게 만나는 날이면. 설레며 기다리는데. 언젠가는 화장 안한 얼굴로. 편한 옷을 입고. 마주 앉아서 아무렇지 않게. 밥 먹는 날도 오겠지. 그런 게 일상이 되어있겠지. 나는 너의 약속이 되고 싶어. 혹시 지키지 못할까봐. 두려워해도 좋아. 곁에 있으니. 나는 너의 웃음을 닮고 싶어. 세상의 모든 걱정을. 잊게 하는. 너의 웃음을. 난 여전히 꿈꾸고 싶어. 이대로 함께하고 싶어. 바래지지 않을 거지. 나는 너의 약속이 되고 싶어. 혹시 지키지 못할까봐. 두려워해도 좋아. 곁에 있으니. 나는 너의 웃음을 닮고 싶어. 세상의 모든 걱정을. 잊게 하는. 너의 웃음을,0,1,
시간을 돌리는 마법사 (Feat. SHINHYO),그대도 알까요. 난 매일 이 꿈속에서. 손을 잡고 함께 거닐었단 걸. 달콤한 이 순간에. 더 머물고 싶어져요. 그댄 모를 거야. 여전히 멋져 보여요. 혹시 티가 날까. 내 추억으로 남겨요. 그래도 오늘밤도 내 꿈속에서. 나타나주면 안돼요. 그대는 내 시간을 돌리는 마법사. 우리 조금 천천히 가요. 그대와 있는 이 순간순간을. 좀 더 간직하고 싶은데. 거짓말 같이 빨라 이 세상이. 그대와 나만의 것인 것 같아. 내 맘이 조금도 조급하지 않게. 그대가 날 붙들어줘요 이렇게. 그대와 열어볼 선물 같아요. 지금도 함께 있다는 게. 벅차는걸요. 달콤한 이 순간이. 그리워질 것 같아요. 그댄 모를 거야. 여전히 난 두려워요. 혹시 스쳐 갈까. 오늘도 겁먹곤 하죠. 그래도 오늘밤도 내 꿈속에서. 나타나주면 안돼요. 그대는 내 시간을 돌리는 마법사. 우리 조금 천천히 가요. 그대와 있는 이 순간순간을. 좀 더 간직하고 싶은데. 거짓말 같이 빨라 이 세상이. 그대와 나만의 것인 것 같아. 내 맘이 조금도 조급하지 않게. 그대가 날 붙들어줘요 이렇게. 우리 함께 있는 이 순간에도. 시간은 흐르고 있잖아요. 눈 깜빡할 새 오늘도. 내일의 어제가 돼있겠죠. 그대는 내 시간을 돌리는 마법사. 우리 조금 천천히 가요. 그대와 있는 이 순간순간을. 좀 더 간직하고 싶은데. 거짓말 같이 빨라 이 세상이. 그대와 나만의 것인 것 같아. 내 맘이 조금도 조급하지 않게. 그대가 날 붙들어줘요 이렇게,0,1,
서울,왠지 그냥 좋을 것만 같았던. 서울에서 지낸다는 게. 처음엔 마냥 설��어. 다 이룰 줄만 알았던. 이곳은 참 쉽진 않더라. 매일 난 겨우 버텼어. 그러다 너를 만났고. 낯설기만 했던 이 서울이. 조금씩 좋아졌어. 복잡한 이 도시에서. 어떻게 너를 만났을까. 아직 너무 신기해. 어지럽게 수놓았던. 바쁜 일상 속에. 한줄기 빛이 돼준. 네가 고마워. 해질녘 네 눈에 비춰진 한강은. 언제나 빛나고 있어. 널 만나 서울이 너무나 행복해. 지금처럼 내 곁에 있어줘. 이 넓은 세상 속에서. 우연히 너를 마주쳤던. 홍대 앞 그 거리가. 아직도 나는 꿈같아. 처음 너와 탔던 따릉이도. 전부 다 잊지 못해 난. 뒤도 돌아보지 않던. 바쁜 일상 속에. 천천히 걷는 길을. 가르쳐준 너야. 푸른 밤 네 눈에 비춰진 한강은. 언제나 빛나고 있어. 널 만나 서울이 너무나 행복해. 지금처럼 내 곁에 있어줘. 너와 함께 걷던 거리가 모두 내겐 꿈인데. 너 없는 서울은 이젠 생각하긴 싫어. 어두운 밤 서울의 불빛은 널 닮아. 언제나 빛나고 있어. 너 없는 서울이 이젠 난 힘들어. 지금처럼 내 곁에 있어줘. 네가 있는 서울이 행복해,0,1,
서울 (inst.),왠지 그냥 좋을 것만 같았던. 서울에서 지낸다는 게. 처음엔 마냥 설��어. 다 이룰 줄만 알았던. 이곳은 참 쉽진 않더라. 매일 난 겨우 버텼어. 그러다 너를 만났고. 낯설기만 했던 이 서울이. 조금씩 좋아졌어. 복잡한 이 도시에서. 어떻게 너를 만났을까. 아직 너무 신기해. 어지럽게 수놓았던. 바쁜 일상 속에. 한줄기 빛이 돼준. 네가 고마워. 해질녘 네 눈에 비춰진 한강은. 언제나 빛나고 있어. 널 만나 서울이 너무나 행복해. 지금처럼 내 곁에 있어줘. 이 넓은 세상 속에서. 우연히 너를 마주쳤던. 홍대 앞 그 거리가. 아직도 나는 꿈같아. 처음 너와 탔던 따릉이도. 전부 다 잊지 못해 난. 뒤도 돌아보지 않던. 바쁜 일상 속에. 천천히 걷는 길을. 가르쳐준 너야. 푸른 밤 네 눈에 비춰진 한강은. 언제나 빛나고 있어. 널 만나 서울이 너무나 행복해. 지금처럼 내 곁에 있어줘. 너와 함께 걷던 거리가 모두 내겐 꿈인데. 너 없는 서울은 이젠 생각하긴 싫어. 어두운 밤 서울의 불빛은 널 닮아. 언제나 빛나고 있어. 너 없는 서울이 이젠 난 힘들어. 지금처럼 내 곁에 있어줘. 네가 있는 서울이 행복해,0,1,
겨울에 피는 꽃,세상이 아무리 추워도. 피는 꽃이 있대요. 세상이 아무리 가혹하다고 해도. 피는 꽃이 있대요. 모든 게 얼어붙어도. 마음만은 얼지 않아요. 모든 걸 녹일 만큼. 따듯하니까요. 거리엔 추위에 떠는 사람들이 가득해요. 눈보라 치는 겨울을 원망하고 원망해요. 다시 봄이 오듯. 우리에게도 봄이 올 거예요. 그러니까 우린 다시. 일어설 수 있을 거예요. 이겨낼 수 있을 거예요. 모든 게 얼어붙어도. 마음만은 얼지 않아요. 모든 걸 녹일 만큼. 따듯하니까요. 거리엔 추위에 떠는 사람들이 가득해요. 눈보라 치는 겨울을 원망하고 원망해요. 다시 봄이 오듯. 우리에게도 봄이 올 거예요. 그러니까 우린 다시. 일어설 수 있을 거예요. 이겨낼 수 있을 거예요. 쌓인 눈이 천천히 녹아내리면. 그 전율에 고인 눈물이. 예고 없이 흐르네요. 따듯한 햇살도 우리의 마음을. 알아줄 거예요. 이겨낼 수 있을 거예요. 다 괜찮아질 거예요,0,1,
겨울에 피는 꽃 (Inst.),세상이 아무리 추워도. 피는 꽃이 있대요. 세상이 아무리 가혹하다고 해도. 피는 꽃이 있대요. 모든 게 얼어붙어도. 마음만은 얼지 않아요. 모든 걸 녹일 만큼. 따듯하니까요. 거리엔 추위에 떠는 사람들이 가득해요. 눈보라 치는 겨울을 원망하고 원망해요. 다시 봄이 오듯. 우리에게도 봄이 올 거예요. 그러니까 우린 다시. 일어설 수 있을 거예요. 이겨낼 수 있을 거예요. 모든 게 얼어붙어도. 마음만은 얼지 않아요. 모든 걸 녹일 만큼. 따듯하니까요. 거리엔 추위에 떠는 사람들이 가득해요. 눈보라 치는 겨울을 원망하고 원망해요. 다시 봄이 오듯. 우리에게도 봄이 올 거예요. 그러니까 우린 다시. 일어설 수 있을 거예요. 이겨낼 수 있을 거예요. 쌓인 눈이 천천히 녹아내리면. 그 전율에 고인 눈물이. 예고 없이 흐르네요. 따듯한 햇살도 우리의 마음을. 알아줄 거예요. 이겨낼 수 있을 거예요. 다 괜찮아질 거예요,0,1,
