title,lyrics,이별유무,긍부정,cluster_label
Hello,"멀어져가는저 달빛.당신 옆 가려진푸른 달에.언제쯤 아픔을 뒤로.너를볼 수 있을까.이 밤이 지나가면.제자리로 돌아갈까.답답한 마음을 달래도.시간은지 않다.네가 없는 이곳은야 백만마일 떨어져 있다.캄캄한 내 마음속하나뿐인 빛.안녕하세요 저는 그냥 안부 인사하고 싶다.희미해진 기억 속 널 마주 보고 싶어서.안녕하세요 저는 그냥 안부 인사하러 왔다.어둠속에 날 감싸던.따뜻한 숨결이 그리워.안녕하세요, 안녕하세요, 안녕하세요.지내고 있잘넌 어때.안녕하세요, 안녕하세요, 안녕하세요.이 노래가 들리니.손이 닿지 못한.빛도 바라보지 못한.팔목을 잡아 내지금 상황이.나는 또 우린 더. 저빛을잡을 수 있게 작동을 유지합니다.누군가 누군가 말했다.애써 웃고 있다고.그때로 그대로 다. 아기 너무 많이 당신이 그리워요.네가 없는 이곳은야 백만마일 떨어져 있다.캄캄한 내 마음속하나뿐인 빛.안녕하세요 저는 그냥 안부 인사하고 싶다.희미해진 기억 속 널 마주 보고 싶어서.안녕하세요 저는 그냥 안부 인사하러 왔다.어둠속에 날 감싸던.따뜻한 숨결이 그리워.닫혀진하늘속에 사랑.영원하지않을 그림자 속에.빛을기다리고 있는 우리.안녕하세요.보고 싶어서 마주 희미해진 기억속 널.저버리지 마세요.안녕하세요 저는 그냥 안부 인사하러 왔다.안녕하세요 안녕하세요.어둠속에 날 감싸던.따뜻한 숨결이 그리워.안녕하세요, 안녕하세요, 안녕하세요.지내고 있잘넌 어때.안녕하세요, 안녕하세요, 안녕하세요.이 노래가 들리니",1,0,5
마침표 (Period),모든게 끝난 날.너와 나에 관한 생각해 보세요.허전한 공기 오날 감싸안고.또널 떠올리게 해. 모든 걸시작한 날.사랑하고 생각해 보세요.예뻤던시간 사진에 묻어두고.또난 추억하게 돼. 우리 시간을갖는 건. 그게 답일까.난 어쩔 수 없다는 걸 알아.노력이라는사랑이 아닌 이름.저도 절 안 사랑을 안다.놓아준다는겹겹이 쌓인 변명.저도 절 안 사랑을 안다.누군가 알고 있다.누군가 알고 있다.누군가 알고 있다.누군가가 걸린다.누군가 떠나 버리게 할 것이다.나는 wanna를 열고 싶어 하다.나는을 열고 싶어 하고 있다.당신은 나에게 작별을 고하다.모든 말 그네가 한. 자꾸 마음아프게 더. 자꾸 내려 나는.채워질수 없는 외로움.원한 만큼 너를아파하는 만큼.힘이들어지기만 해 매일.그러니까아무렇지 않은 척. 그렇게 괜찮은 척 또 센 척하고 살아.언제부터이렇게 돼 버렸는지.우린 다 쓰고남은 마음.돌아가고파. 난 어쩔 수 없다는 걸 알아.노력이라는사랑이 아닌 이름.저도 절 안 사랑을 안다.놓아준다는겹겹이 쌓인 변명.저도 절 안 사랑을 안다.누군가 알고 있다.누군가 알고 있다.누군가 알고 있다.누군가가 걸린다.누군가 떠나 버리게 할 것이다.나는 wanna를 열고 싶어 하다.나는을 열고 싶어 하고 있다.당신은 나에게 작별을 고하다.이런 결말이었다면.노력하지 말걸.너의 기억 모든게 아파. 난 이렇게널 미워하면서.또 그리워하고 있어.누군가 알고 있다.누군가 알고 있다.누군가 알고 있다.누군가가 걸린다.누군가 떠나 버리게 할 것이다.나는 wanna를 열고 싶어 하다.나는을 열고 싶어 하고 있다.당신은 나에게 작별을 고하다.모든게 끝난 날.너와 나에 관한 생각해 보세요.허전한 공기 날 감싸안고,1,0,3
꿈에,까만 밤이 내리면. 고요함이 내리면. 그대를 만날 준비를 해요. 까만 밤이 내리면. 저 건너편에 서있는 그대. 익숙한 뒷모습의 그댄. 마치 늘 내곁에 있단듯. 걷네요. 나만 혼자 묻네요. 그댄 그저 웃음만 짓네요. 나만 혼자 우네요. 그댄 그저 웃음만 짓네요. 행여 이 꿈이 깨질까봐. 조심스레 걸어요. 나만 혼자 묻네요. 그댄 그저 웃음만 짓네요. 나만 혼자 우네요. 그댄 그저 웃음만. 행여 이 꿈이 끝날까봐. 그댈 잡지 않아요,1,0,1
돌아가고 싶다,할 말이 많은데. 내 곁에는 네가 없어. 언제나 내 하루 끝에는. 네가 서 있었는데. 너의 목소리가. 내 귓가에 맴도는데. 이젠 들을 수 없잖아. 정말 끝인가 봐. 왜 왜 나를 떠나니. 우린 미칠 듯 사랑했잖아. 어떻게 너와 이별을 하니. 시간이 지날수록 네가 더. 선명해져 가잖아. 네가 없이 난 안될 것 같아. 너를 잊으려고 노력해봐도. 그게 안되잖아. 뜨겁게 사랑했던 그때로. 돌아가고 싶다. 오늘이 지나면. 내일은 좀 나아질까. 아직도 돌아보면 네가. 웃어 줄 것만 같아. 지나온 추억에. 가슴이 또 시려온다. 이젠 만날 수 없잖아. 정말 끝인가 봐. 왜 왜 나를 떠나니. 우린 미칠 듯 사랑했잖아. 어떻게 너와 이별을 하니. 시간이 지날수록 네가 더. 선명해져 가잖아. 네가 없이 난 안될 것 같아. 너를 잊으려고 노력해봐도. 그게 안되잖아. 뜨겁게 사랑했던 그때로. 돌아가고 싶다. 늘 같이 걷던 그 거리 위에. 너를 외쳐보고 또 외쳐봐도. 우린 여기까진가 봐. 우린 미칠 듯 사랑했잖아. 어떻게 너와 이별을 하니. 시간이 지날수록 네가 더. 선명해져 가잖아. 네가 없이 난 안될 것 같아. 너를 잊으려고 노력해봐도. 그게 안되잖아. 뜨겁게 사랑했던 그때로. 돌아가고 싶다,1,0,5
오늘까지만,오늘까지만 곁에 있어줘. 우린 아직 사랑하잖아. 너 없이는 아무 것도. 할 수 없는 내가 싫어. 단 한번도 너를 떠나는 일. 생각조차 못했어. 헤어지기 싫어 널 보내기 싫어. 어떻게 니가 없이 살겠니. 남들과는 다른 사랑이라고 믿었는데. 널 믿었는데 왜 날 떠나니. 단 한번도 너를 떠나는 일. 생각조차 못했어. 헤어지기 싫어 널 보내기 싫어. 어떻게 니가 없이 살겠니. 남들과는 다른 사랑이라고 믿었는데. 널 믿었는데 왜 날 떠나니. 여전히 나는 아프기만 해. 넌 다 잊을 수가 있니. 사랑을 했는데 이렇게 헤어져. 아프고 아파 어떡해하니. 사랑했던 날들 그때 그리워. 오늘도 난 내 마음속에 널 그리워 해,1,0,1
겨울이 지나고 봄이 오듯이,정말 사랑했었는데.너무 행복했었는데.이렇게 됐을까 우린대체 왜.답답한 맘에.자꾸 눈물이.혼자시들어버린 것 같아.점점쌓여만 가는 외로움.아파표정 없는 날들.너는아무렇지 않나 봐. 우리 사랑잠깐만 쉬어요.아주 잠시 동안만 멈춰 서기로 해요.수많은 시간을 고민하다가.몇 번을 망설이다.어렵게 말해요.우리사랑 이대로는 안돼요.서로에게 시간이.필요할 것 같아요.보고 싶어 견뎌내기힘들 때. 겨울이 지나고또 봄이 오듯이.돌아가요. 밤새 내얘길 들어주고.한참안아주던 한 사람.이렇게 됐을까 우린대체 왜.난 No계절이차가운 이.우리사랑 잠깐만 쉬어요.아주 잠시 동안만 멈춰 서기로 해요.수많은 시간을 고민하다가.몇 번을 망설이다.어렵게 말해요.우리사랑 이대로는 안돼요.서로에게 시간이.필요할 것 같아요.보고 싶어 견뎌내기힘들 때. 겨울이 지나고또 봄이 오듯이.돌아가요. 며칠지나지 않았는데.벌써 너의 빈자리가.더 크게 느껴져.사실많이 불안했던 거죠.혹시나 네가 내게 이별을 말할까 봐. 먼저 시간을갖자고 했던 건. 너 없인 하루도 안 되는 날 아니까.나는 여전히 사랑 내 사랑인 너에 가겠다.이런 내 맘 너도 알고 있다면.우리 처음 만났던그날을 기억해요.하나둘씩상처가 아물 때쯤.겨울이 지나고 또봄이 오듯이.돌아가요,1,0,5
겨울이 지나고 봄이 오듯이 (Inst.),정말 사랑했었는데.너무 행복했었는데.이렇게 됐을까 우린대체 왜.답답한 맘에.자꾸 눈물이.혼자시들어버린 것 같아.점점쌓여만 가는 외로움.아파표정 없는 날들.너는아무렇지 않나 봐. 우리 사랑잠깐만 쉬어요.아주 잠시 동안만 멈춰 서기로 해요.수많은 시간을 고민하다가.몇 번을 망설이다.어렵게 말해요.우리사랑 이대로는 안돼요.서로에게 시간이.필요할 것 같아요.보고 싶어 견뎌내기힘들 때. 겨울이 지나고또 봄이 오듯이.돌아가요. 밤새 내얘길 들어주고.한참안아주던 한 사람.이렇게 됐을까 우린대체 왜.난 No계절이차가운 이.우리사랑 잠깐만 쉬어요.아주 잠시 동안만 멈춰 서기로 해요.수많은 시간을 고민하다가.몇 번을 망설이다.어렵게 말해요.우리사랑 이대로는 안돼요.서로에게 시간이.필요할 것 같아요.보고 싶어 견뎌내기힘들 때. 겨울이 지나고또 봄이 오듯이.돌아가요. 며칠지나지 않았는데.벌써 너의 빈자리가.더 크게 느껴져.사실많이 불안했던 거죠.혹시나 네가 내게 이별을 말할까 봐. 먼저 시간을갖자고 했던 건. 너 없인 하루도 안 되는 날 아니까.나는 여전히 사랑 내 사랑인 너에 가겠다.이런 내 맘 너도 알고 있다면.우리 처음 만났던그날을 기억해요.하나둘씩상처가 아물 때쯤.겨울이 지나고 또봄이 오듯이.돌아가요,1,0,5
이상한 하루,이상하리만큼 널 보내고. 아무렇지 않던 내가 좀 이상해졌어. 요즘은 가끔씩 널 그리곤 해. 나도 모르게 우울했어. 함께한 모든 날들이. 아무 일 없듯 모두 사라져 간대도. 수없이 흔들리는 마음을 다잡고. 하염없는 오늘을 견뎌야 해. 너란 사람은 밉게도. 내 맘 속 한 켠에 아직도 남아. 날 아프게 해. 참 이상한 하루야 네 생각이 나는. 오늘 하루가. 이상하리만큼 널 보내고. 궁금하지도 않았던. 네 소식을 찾아. 너무도 알 수 없는 너라서 일까. 괜찮은 척하며 지내야 해. 함께한 모든 날들이. 아무 일 없듯 모두 사라져 간대도. 수없이 흔들리는 마음을 다잡고. 하염없는 오늘을 견뎌야 해. 너란 사람은 밉게도. 내 맘 속 한 켠에 아직도 남아. 날 아프게 해. 참 이상한 하루야. 네 생각이 나는. 오늘 하루가. 함께한 모든 날들이. 아무 일 없듯 모두 사라져 간대도. 마음을 다잡고. 하염없는 오늘을 견뎌야 해. 너란 사람은 밉게도. 내 맘 속 한 켠에 아직도 남아. 날 아프게 해. 참 이상한 하루야. 네 생각이 나는. 오늘 하루가,1,0,0
잊었니,잊었니 니가 고백했던 그 말 잊었니. 날 버리지 않겠다던 그 약속. 그렇게 쉬운 약속이었니. 잊었니 니가 고백했던 그 말 잊었니. 날 버리지 않겠다던 그 약속. 그렇게 쉬운 약속이었니 정말. 알잖니 너만 사랑했던 나를 알잖니. 너를 위해 준비했던 시간이. 날 붙잡고 어떡하냐고 내게 묻잖니. 난 절대 안녕이란 말 하지 않을거야. 안녕이란 그 말 하지 마. 그렇게 쉽게 잊을 수 있다면. 잊는다면 그렇게 된다면 널 잊겠어. I know you pass me bye. 내게 아무 변명하지 마 말하지 마. 너무 익숙해진 너의 습관. 이제 지우려 노력할게. 울잖니 널 볼 수 없단 내 맘이 울잖니. 너 몰래 흘려왔었던 눈물이. 보기 싫다면 웃어줄게 정말. 간다면 정말 날 버리고 가야 한다면. 아무리 크게 널 불러보아도 들을 수 없게. 네 기억마저 내가 가질게. 난 절대 안녕이란 말하지 않을거야. 안녕이란 그 말 하지 마. 그렇게 쉽게 잊을 수 있다면. 잊는다면 그렇게 된다면 널 잊겠어. 난 너가 내게 작별인사를 할 걸 알아. 내게 아무 변명하지 마 말하지 마. 너무 익숙해진 너의 습관. 이제 지우려 노력할게. 나도 그대를 잊어볼게. 니가 편히 떠날 수 있게. 그대가 그랬듯 또 다른 사랑을. 나도 아마 할 수 있겠지. 난 절대 안녕이란 말하지 않을거야. 안녕이란 그 말 하지 마. 그렇게 쉽게 잊을 수 있다면. 잊는다면 그렇게 된다면 널 잊겠어. 난 너가 내게 작별인사를 할 걸 알아. 내게 아무 변명하지 마 말하지 마. 너무 익숙해진 너의 습관. 이제 지우려 노력할게. 잊었니 니가 고백했던 그 말 잊었니. 날 버리지 않겠다던 그 약속. 그렇게 쉬운 약속이었니,1,0,5
잊었니(Inst.),잊었니 니가 고백했던 그 말 잊었니. 날 버리지 않겠다던 그 약속. 그렇게 쉬운 약속이었니. 잊었니 니가 고백했던 그 말 잊었니. 날 버리지 않겠다던 그 약속. 그렇게 쉬운 약속이었니 정말. 알잖니 너만 사랑했던 나를 알잖니. 너를 위해 준비했던 시간이. 날 붙잡고 어떡하냐고 내게 묻잖니. 난 절대 안녕이란 말 하지 않을거야. 안녕이란 그 말 하지 마. 그렇게 쉽게 잊을 수 있다면. 잊는다면 그렇게 된다면 널 잊겠어. I know you pass me bye. 내게 아무 변명하지 마 말하지 마. 너무 익숙해진 너의 습관. 이제 지우려 노력할게. 울잖니 널 볼 수 없단 내 맘이 울잖니. 너 몰래 흘려왔었던 눈물이. 보기 싫다면 웃어줄게 정말. 간다면 정말 날 버리고 가야 한다면. 아무리 크게 널 불러보아도 들을 수 없게. 네 기억마저 내가 가질게. 난 절대 안녕이란 말하지 않을거야. 안녕이란 그 말 하지 마. 그렇게 쉽게 잊을 수 있다면. 잊는다면 그렇게 된다면 널 잊겠어. 난 너가 내게 작별인사를 할 걸 알아. 내게 아무 변명하지 마 말하지 마. 너무 익숙해진 너의 습관. 이제 지우려 노력할게. 나도 그대를 잊어볼게. 니가 편히 떠날 수 있게. 그대가 그랬듯 또 다른 사랑을. 나도 아마 할 수 있겠지. 난 절대 안녕이란 말하지 않을거야. 안녕이란 그 말 하지 마. 그렇게 쉽게 잊을 수 있다면. 잊는다면 그렇게 된다면 널 잊겠어. 난 너가 내게 작별인사를 할 걸 알아. 내게 아무 변명하지 마 말하지 마. 너무 익숙해진 너의 습관. 이제 지우려 노력할게. 잊었니 니가 고백했던 그 말 잊었니. 날 버리지 않겠다던 그 약속. 그렇게 쉬운 약속이었니,1,0,5
와르르,밤이 깊어 가. 하루 종일 애써 꾹꾹 눌러 참다. 떠오는 너의 얼굴에. 다시 난 무너진다. 또 와르르 난 와르르. 무엇도 할 수가 없어. 이 눈물이 흐르고 흘러. 네 맘을 어르는 되돌리는. 기적이 내게 온다면. 꼭 한 번만 두 눈에 널 담기를. 아마 없겠지. 네 마음을 돌리는 그런 행운 따윈. 아무것도 할 수 없어. 너로 나 살았었기에. 또 와르르 난 와르르. 무엇도 할 수가 없어. 이 눈물이 흐르고 흘러. 네 맘을 어르는 되돌리는. 기적이 내게 온다면. 꼭 한 번만 두 눈에. 널 한 번만 내 품에. 온종일 파르르 떨고 있는. 내가 나도 참 낯설어. 또 와르르 네가 쏟아진다. 또 와르르 내가 무너진다,1,0,1
사랑아,혼자서 불러보는 가슴 아픈 그 이름. 눈물이 새어 나올까봐 입술을 깨물고. 또다시 다짐하듯 가슴을 펴 보지만. 홀로 남겨진 내 모습이. 더욱 초라해져. 사랑아 그리운 내 사랑아. 이렇게 아픈 내 사랑아. 얼마나 아프고 아파해야. 아물수 있겠니. 사랑아 그리운 내 사랑아. 이렇게 아픈 내 사랑아. 얼마나 아프고 아파해야. 아물수 있겠니. 사랑아 미련한 내 사랑아. 버릴수 없는 내 욕심에. 못다한 사랑이 서러워서. 또 이렇게 운다. 얼마나 아프고 아파해야. 아물수 있겠니. 내 사랑아,1,0,1
인형,아침이 오는 소리에 난 잠이 들어요.오늘도 역시 그대. 날잊고 보냈었는지.그렇게도 쉽게 괜찮을수 있는지.항상 변함이 없었던 그대 떠나간 게. 믿을 수없어 힘들었죠.그냥 그렇게 서로가.조금씩 잊혀 가겠죠.사랑한단말 조차도 소용없겠죠.미안해요 이기적인 나였죠.사랑한단이유로 내 곁에만.두려했었던 걸요.그래요난 가장 중요한걸.모르고 있었죠.사랑한다면. 그대가언제나 행복해야죠.보고 싶겠죠 그건 어쩔 수 없겠죠.하지만힘들진 않게 할게요.한동안 많이 아파울다 지쳐.그대를 찾겠죠.신경쓰지 말아요 You. 잠시뿐일 테니까.괜찮아요 이대로 있을게요.당신과 상관없이.그냥 홀로 지킬수 있는걸요.사랑해요 정말 한순간도.변함이 없어요.그대 없는 빈자리도.사랑하며 살아갈게요.수 없겠죠 어쩔보고싶겠죠 그건.하지만힘들진 않게 할게요.한동안 많이 아파울다 지쳐.그대를 찾겠죠.신경쓰지 말아요 You. 잠시뿐일 테니까.오 그래요 You. 바보 같지만.우리 지난 기억들.간직하며홀로 지키고 있을게.한동안 많이 아파.울다지쳐 그대를 찾겠죠.신경 쓰지 말아요.난 잠시 뿐일 이별이니까,1,0,0
인형,아침이 오는 소리에 난 잠이 들어요.오늘도 역시 그대. 날잊고 보냈었는지.그렇게도 쉽게 괜찮을수 있는지.항상 변함이 없었던 그대 떠나간 게. 믿을 수없어 힘들었죠.그냥 그렇게 서로가.조금씩 잊혀 가겠죠.사랑한단말 조차도 소용없겠죠.미안해요 이기적인 나였죠.사랑한단이유로 내 곁에만.두려했었던 걸요.그래요난 가장 중요한걸.모르고 있었죠.사랑한다면. 그대가언제나 행복해야죠.보고 싶겠죠 그건 어쩔 수 없겠죠.하지만힘들진 않게 할게요.한동안 많이 아파울다 지쳐.그대를 찾겠죠.신경쓰지 말아요 You. 잠시뿐일 테니까.괜찮아요 이대로 있을게요.당신과 상관없이.그냥 홀로 지킬수 있는걸요.사랑해요 정말 한순간도.변함이 없어요.그대 없는 빈자리도.사랑하며 살아갈게요.수 없겠죠 어쩔보고싶겠죠 그건.하지만힘들진 않게 할게요.한동안 많이 아파울다 지쳐.그대를 찾겠죠.신경쓰지 말아요 You. 잠시뿐일 테니까.오 그래요 You. 바보 같지만.우리 지난 기억들.간직하며홀로 지키고 있을게.한동안 많이 아파.울다지쳐 그대를 찾겠죠.신경 쓰지 말아요.난 잠시 뿐일 이별이니까,1,0,0
환상,그대여 돌아올 순 없나요. 우리 다시 예전처럼 말예요. 서로를 가졌단 이유만으로. 너무도 행복했던. 그대여 지금 행복한가요. 그 사람이 그렇게 해주나요. 아니면 그대 내게 돌아와요. 난 항상 기다려요. 그대 떠난 걸 헤어졌다는걸. 혼자라는 걸 난 믿을 수가 없는 걸. 저 문을 열고 걸어들어오는. 그대 모습만 아직도 떠오르는걸. 아직도 그댈 기다린다면. 아직도 그대 생각에 운다면. 그대는 믿을 수가 없겠지요. 날 바보라 하겠죠. 그대 떠난 걸 헤어졌다는걸. 혼자라는 걸 난 믿을 수가 없는 걸. 저 문을 열고 걸어들어오는. 그대 모습만 아직도 떠오르는걸. 그대 날 떠나 얼마나 행복해졌나요. 내가 없는 삶이 훨씬 더 좋던가요. 나는 그대 떠나간 뒤. 텅 빈 그 자리를. 그 어떤 것으로도 채우질 못해요. 그대 떠난 걸 헤어졌다는걸. 혼자라는 걸 난 믿을 수가 없는 걸. 저 문을 열고 걸어들어오는. 그대 모습만 아직도 떠오르는걸,1,0,2
환상,그대여 돌아올 순 없나요. 우리 다시 예전처럼 말예요. 서로를 가졌단 이유만으로. 너무도 행복했던. 그대여 지금 행복한가요. 그 사람이 그렇게 해주나요. 아니면 그대 내게 돌아와요. 난 항상 기다려요. 그대 떠난 걸 헤어졌다는걸. 혼자라는 걸 난 믿을 수가 없는 걸. 저 문을 열고 걸어들어오는. 그대 모습만 아직도 떠오르는걸. 아직도 그댈 기다린다면. 아직도 그대 생각에 운다면. 그대는 믿을 수가 없겠지요. 날 바보라 하겠죠. 그대 떠난 걸 헤어졌다는걸. 혼자라는 걸 난 믿을 수가 없는 걸. 저 문을 열고 걸어들어오는. 그대 모습만 아직도 떠오르는걸. 그대 날 떠나 얼마나 행복해졌나요. 내가 없는 삶이 훨씬 더 좋던가요. 나는 그대 떠나간 뒤. 텅 빈 그 자리를. 그 어떤 것으로도 채우질 못해요. 그대 떠난 걸 헤어졌다는걸. 혼자라는 걸 난 믿을 수가 없는 걸. 저 문을 열고 걸어들어오는. 그대 모습만 아직도 떠오르는걸,1,0,2
후회만이 (Feat. 임도혁),널 생각해서 우울해진 건지. 우울해져서 널 생각한 건지. 아무 일 없이 지내던. 내 하루하루가. 나도 모르게 그리워진 건지. 일부러 모른척했는지. 내 감정을 속여가며. 살아왔었던 걸까. 유난히 맑은 날씨도. 우연히 마주친 친구마저 왜 그런지. 전혀 반갑지가 않아. 때늦은 후회만이. 못다 한 사랑만이. 불쑥 고개를 내밀어. 아프게 내 가슴을 찢는 밤. 정말로 나 자신 있었는데. 너 없이 괜찮았는데. 무던한 날들에. 느닷없이 찾아온 너와의. 지난 추억. 함께 듣고 부르던 노래들이. 같이 걸었던 산책길이. 니 흔적이 지워진 듯. 날 흔들지 않았는데. 완벽히 널 잊어냈다고. 완전히 난 아무렇지 않은데 멀쩡한데. 왜 아무것도 할 수가 없어. 때늦은 후회만이. 못다 한 사랑만이. 불쑥 고개를 내밀어. 아프게 내 가슴을 찢는 밤. 정말로 나 자신 있었는데. 너 없이 괜찮았는데. 무던한 날들에. 느닷없이 찾아온 너와의. 빛 바랜 추억. 아련했던 우리 추억이. 자꾸 떠올라 점점 선명해져. 그리운 그대만이. 그때의 행복만이. 이제야 사랑인 걸 알아. 아프게 내 가슴을 찢는 밤. 시간을 되돌릴 수 있다면. 한 번 더 기횔 준다면. 지나간 추억에. 밤새 너를 그리며 쓸쓸한. 후회만이,1,0,5
후회만이 (Inst.),널 생각해서 우울해진 건지. 우울해져서 널 생각한 건지. 아무 일 없이 지내던. 내 하루하루가. 나도 모르게 그리워진 건지. 일부러 모른척했는지. 내 감정을 속여가며. 살아왔었던 걸까. 유난히 맑은 날씨도. 우연히 마주친 친구마저 왜 그런지. 전혀 반갑지가 않아. 때늦은 후회만이. 못다 한 사랑만이. 불쑥 고개를 내밀어. 아프게 내 가슴을 찢는 밤. 정말로 나 자신 있었는데. 너 없이 괜찮았는데. 무던한 날들에. 느닷없이 찾아온 너와의. 지난 추억. 함께 듣고 부르던 노래들이. 같이 걸었던 산책길이. 니 흔적이 지워진 듯. 날 흔들지 않았는데. 완벽히 널 잊어냈다고. 완전히 난 아무렇지 않은데 멀쩡한데. 왜 아무것도 할 수가 없어. 때늦은 후회만이. 못다 한 사랑만이. 불쑥 고개를 내밀어. 아프게 내 가슴을 찢는 밤. 정말로 나 자신 있었는데. 너 없이 괜찮았는데. 무던한 날들에. 느닷없이 찾아온 너와의. 빛 바랜 추억. 아련했던 우리 추억이. 자꾸 떠올라 점점 선명해져. 그리운 그대만이. 그때의 행복만이. 이제야 사랑인 걸 알아. 아프게 내 가슴을 찢는 밤. 시간을 되돌릴 수 있다면. 한 번 더 기횔 준다면. 지나간 추억에. 밤새 너를 그리며 쓸쓸한. 후회만이,1,0,5
Memory,비가 오는 날에 기억의 밤을 지나.우린 그 끝에서입을 맞추고.타버릴 꽃처럼.운명의 불에 빠져.다시 피어나 맴돌아또 난. 뚝 뚝 두 볼에 눈물이 흘러요.지우려는기억이 또 떠올라.늘그렇게 더 아프게.날 괴롭힌다면.이제는 더 이상숨기 싫어.비가 오는 날에 기억의 밤을 지나.우린 그 끝에서입을 맞추고.타버릴 꽃처럼.운명의 불에 빠져.다시 피어나 맴돌아또 난. 이제는 말할게.나는 내가 사랑하는 거 알지그대로 있어 줘. 나는 내가 당신을 필요로 하는지 알고 있다.부서지는 시간 속에. 널 볼수 있다면.이제는 더 이상놓치지 않아.떠나가버린 계절 속에. 다시 널느낄 수만 있다면.운명의 미로를 넘어서.널 찾아가. 비가 오는 날에 기억의 밤을 지나.우린 그 끝에서입을 맞추고.타버릴 꽃처럼.운명의 불에 빠져.다시 피어나 맴돌아 또 난,1,0,2
