title,lyrics,이별유무,긍부정,cluster_label
이 못난 나를 (Prod. By LA박피디-박상균),숨을 쉴 수 없죠. 그대 생각나면. 잠을 잘 수 없고. 도무지 살 수가 없죠. 살아오는 동안. 그대 힘이었는데 전부였는데. 그댈 만난 내 잘못이죠. 헤어질 거면 만나지나 말 것을. 함께 지낸 숱한 날들이. 그게 생각나 가끔은 울겠죠. 이해해줘요 이 못난 나를. 아팠나요 많이. 나 때문인가요. 알고 싶죠 그대. 왜 그리 서둘렀나요. 그대에게 내가 부담이 됐나요. 짐이 됐나요. 그댈 보낸 내 잘못이죠. 살아갈 동안 이젠 짐이 된 거죠. 아프게 한 숱한 순간이. 그게 미안해 가끔 또 울겠죠. 용서해줘요 이 못난 나를. 나란 사람 생각나나요. 기억하나요 가끔 떠오르나요. 바보같이 난 좋았던 추억. 그걸 못 잊어. 자꾸만 그립죠 사랑했나요. 이 못난 나를. 사랑했어요 잘난 그대를,1,0,0
꿈이면 좋겠어 (rewind),밤이 뱉는. 조용한 속삭임이.왠지 슬퍼. 네가 더그리운 밤. 괜찮을줄 알았었는데.여전히 괜찮지 않아.함께일땐짧던 이 밤이.영원처럼 길기만 해. 의미없이 시곌뒤로 돌려.혹시라도 네가 돌아올까봐.감다보니 제자린 걸. 그때 조금만더 잘해줄 걸. 모질게 뱉은말이 자꾸만 생각나.엎질러진 이별일까.널 담던 두 눈엔 자꾸 비가 내려.꿈이면 좋겠어. 지금이. 천천히 멀리.추억이 흩어져간다.근데 맘은 두리번대며 자꾸 널 찾아.의미없이시곌 뒤로 돌려.혹시라도 네가 돌아올까봐.감다보니 제자린걸.그때 조금만 더잘해줄 걸. 모질게 뱉은말이 자꾸만 생각나.엎질러진 이별일까.널 담던 두 눈엔 자꾸 비가 내려.꿈이면 좋겠어. 모든게. 어디를 봐도다 너야.추억이 온통 묻어서.눈을뜰 수가 없어. 어떡해. 의미없이 시곌뒤로 돌려.혹시라도 네가 돌아올까봐.감다보니 제자리야.그때 조금만 더잘해줄 걸. 모질게 뱉은말이 자꾸만 생각나.엎질러진 이별일까.널 담던 두 눈엔 자꾸 비가 내려.꿈이면 좋겠어.돌아와,1,0,0
기다리지마요,나 기다리지 마요 우리의 추억에 날. 나 울리지는 마요. 그 기억 너머의 우리. 좋았던 날들은 모두. 이대로 멈춰 버려요 그만 날 놔줘요. 다시는 마주치지 마요. 그렇게 나를 버려요 이젠 안녕. 그리워 말아요. 그립지 말아요 그대 나를. 날 미워해 줘요 날 사랑하나요. 나도 그대를. 나 기다리지 마요. 우리의 지난날의 나. 나 울지 않을래요 그대 날 떠나도 난. 사랑한다는 기억만. 이대로 간직 해줘요 처음 그날 처럼. 잊어 버리면 안돼요. 내 손을 잡아 주세요 그대로 날. 그리워 말아요. 그립지 말아요 그대 나를. 날 미워해 줘요 날 사랑 하나요. 나도 그댈. 날 사랑 하나요 나 미워요 내가 나도. 날 떠나지마요 거짓말 처럼 널. 다시 안고 싶어,1,0,1
기다리지마요 (Inst.),나 기다리지 마요 우리의 추억에 날. 나 울리지는 마요. 그 기억 너머의 우리. 좋았던 날들은 모두. 이대로 멈춰 버려요 그만 날 놔줘요. 다시는 마주치지 마요. 그렇게 나를 버려요 이젠 안녕. 그리워 말아요. 그립지 말아요 그대 나를. 날 미워해 줘요 날 사랑하나요. 나도 그대를. 나 기다리지 마요. 우리의 지난날의 나. 나 울지 않을래요 그대 날 떠나도 난. 사랑한다는 기억만. 이대로 간직 해줘요 처음 그날 처럼. 잊어 버리면 안돼요. 내 손을 잡아 주세요 그대로 날. 그리워 말아요. 그립지 말아요 그대 나를. 날 미워해 줘요 날 사랑 하나요. 나도 그댈. 날 사랑 하나요 나 미워요 내가 나도. 날 떠나지마요 거짓말 처럼 널. 다시 안고 싶어,1,0,1
나의 여름,어제의 우린 사소한.말로 다퉜어.아픔을 남기고서.그제야 알았어.이렇게 늘 지나고 나서야 알게 돼. 그대-. 내게 와날 안아줘요.온기로 녹여줘 밤을추운 나의.오 나의 되어줘여름이 그대가.그렇게 해요.다른곳을 향하지 마요.오늘 부는 바람은.너무나 추워요.당신이 내쉬는 숨은.나를 아껴줘요.이렇게 늘 지나고 나서야 알게 돼. 그대-. 내게 와날 안아줘요.온기로 녹여줘 밤을추운 나의.오 나의 되어줘여름이 그대가.그렇게 해요.다른곳을 향하지 마요.어떻게 지내요.날이 무척 춥네요.이 곳은 조용해요.조금 지루할 뿐이에요,1,0,1
Fade Away,아름다운 시간 흐려져. 무너지는 하루하루만 난. 끝도 없는 이 길에 있어. 이별이란 너와 나의 길. 함께 했던 추억들도 어색해져 보여. 달라진 너의 표정이 내게 말해. 아무도 거기에 없을 거야. 네가 떠난 그 순간 흩어지고 넌 사라져가. 아무도 거이 없을 거야. 너만 찾던 내 맘은 멈춰 섰어. 기억 모두 사라져가. 습관처럼 다시 떠올려. 무너지는 매일매일 내가. 기다린단 말도 무색해. 이미 다른 모습의 너. 아무렇지도 않은 척도 할 수가 없게 돼. 달라진 네 표정들이 내게 말해. 아무도 거이 없을거야. 네가 떠난 그 순간. 흩어지고 넌 사라져가. 아무도 거기 없을거야. 너만 찾던 내 맘은 멈춰 섰어. 기억 모두 사라져 가. 눈물만 오. 아무도 거기 없을거야. 네가 남긴 모든 게 흩어지고 넌 사라져가. 아무도 거기 없을거야. 너만 찾던 내 맘은 멈춰 섰어. 기억 모두 사라져가. 사라져가.,1,0,2
I'm Missing You,아직모르고 있죠 그댄.얼마나 특별한지.당신의 맘에.이런내가 닿길 바래.조금더 깊어져가 내가.그대와 함께할수록 나.난 널 그리워해.너를 기다린다내 맘이 그대를 향해 있는 걸요.난 널 그리워해.너를 기다린다그댈 오늘도 기다려요.고민이 많아져요 이젠.하루 온종일 그대 생각만 하는 나.난 널 그리워해.너를 기다린다내 맘이 그대를 향해 있는 걸요.난 널 그리워해.너를 기다린다그댈 오늘도 기다려요.언제나 내 곁을 지켜 주었던 그댈.놓치고 싶지 않아요. 정말.난 널 그리워해.너를 기다린다내 맘이 그대를 향해 있는 걸요.난 널 그리워해.너를 기다린다그댈 오늘도 기다려요.그댈 오늘도 기다려요,1,0,1
이 바보야,세상이 멈춘 것 같았어. 우연히 널 거리에서 마주쳤을 때. 가끔 들리는 너의 안부에도. 난 꼭 참았는데. 이 바보야 너 땜에 아프잖아. 왜 또 옷은 춥게 얇게 입었어. 나를 피하는 눈빛이 야윈 너의 얼굴이. 그런 니가 미워서. 나는 또 밤새 취해 간다. 어디부터 잘못된 걸까. 천천히 너에게 맞춰 기다렸다면. 내가 가진 현실은 초라했고. 마음만 커져가고. 나 땜에 힘들다고 했잖아. 행복해지고 싶다 그랬잖아. 어떻게 널 보냈는데. 이 바보야 너 땜에 아프잖아. 왜 또 옷은 춥게 얇게 입었어. 내 전부였던 눈빛이 사랑했던 얼굴이. 여전히 반가워서 눈물이 흘러. 어렸어서 서운해서 소중해서 불안해서. 다 망쳐버린 걸 알아 다 미안해. 이 바보야. 얼마나 사랑했는데. 어떻게 헤어졌는데 다신 만나지 말자. 잡을 수 없게 잘 살아줘,1,0,2
이 바보야,세상이 멈춘 것 같았어. 우연히 널 거리에서 마주쳤을 때. 가끔 들리는 너의 안부에도. 난 꼭 참았는데. 이 바보야 너 땜에 아프잖아. 왜 또 옷은 춥게 얇게 입었어. 나를 피하는 눈빛이 야윈 너의 얼굴이. 그런 니가 미워서. 나는 또 밤새 취해 간다. 어디부터 잘못된 걸까. 천천히 너에게 맞춰 기다렸다면. 내가 가진 현실은 초라했고. 마음만 커져가고. 나 땜에 힘들다고 했잖아. 행복해지고 싶다 그랬잖아. 어떻게 널 보냈는데. 이 바보야 너 땜에 아프잖아. 왜 또 옷은 춥게 얇게 입었어. 내 전부였던 눈빛이 사랑했던 얼굴이. 여전히 반가워서 눈물이 흘러. 어렸어서 서운해서 소중해서 불안해서. 다 망쳐버린 걸 알아 다 미안해. 이 바보야. 얼마나 사랑했는데. 어떻게 헤어졌는데 다신 만나지 말자. 잡을 수 없게 잘 살아줘,1,0,2
보고 싶어,보고 싶어. 새하얀 입김으로. 새어 나왔던. 내 맘은 어디에 닿질 못하고. 찬 공기 사이로 천천히. 흩어져 버린다. 푸른빛의 스웨터를 입은 사람. 보게 될 때면. 괜시리 맘이 쿵 내려앉는다. 혹 그댈 마주친 것처럼. 마음이 일렁거린다. 그대는 여전히. 겨울이 좋은가요. 나는 매번 달라요. 아프다가도 반갑기도 해. 올해는 많이도 그리워요 그대가. 정말 보고 싶어. 혼잣말만 해봐요. 계절마다. 쌓여있던 추억은 다행스럽게. 시간이 하나둘씩 덜어줬죠. 다만 겨울에 담긴 추억은. 해마다 점점 선명해져. 그대는 여전히. 겨울이 좋은가요. 나는 매번 달라요. 아프다가도 반갑기도 해. 올해는 많이도 그리워요 그대가. 정말 보고 싶어. 혼잣말만 해봐요. 유난히 추웠던 그 날 밤. 평소보다 조금 늦은 그댄. 정말 미안해하며. 그대의 따뜻한 손을. 나의 주머니 속에 넣었죠. 그때의 온기가. 지금도 그리워요. 그대 예쁜 미소도. 하나 빠짐없이 선명해요. 올해는 유난히 그리워요 그대가. 정말 보고 싶어. 보고 싶다 말하면. 한달음에 달려갔던 그때처럼,1,0,0
Can We Talk Again,우리는 왜 이러는지.너무이해가 안 돼. 미안하단말 한마디.왜 쉽지 않은지.잘됐어 아니 후회해.자꾸 못된 네가떠나질 않아.지금 분명한 건.자기 생각만 했었지사실 네가 그리워.이젠솔직히 네가 보고싶어.이 자리로 다시 돌아왔어요.우리가 다시 얘기할 수 있을까.다시 시도해 볼 수 있다.우리 예전처럼 돌아가.또웃을 수 있다면.다시 사랑을 다시 또.다시 사랑을 다시 또.아무일도 없는 것처럼.네게로 다시 돌아왔어요.네게로 다시 돌아왔어요.생각보다 더 외로워더 괴로워.네존재가 너무나 컸으니까.미련을버리지 못한 난 이 바보야.너와함께 한 시간.차라리잊어버리고 싶어 You. 별일 아닌 것처럼 또 없던 것처럼.태연하게 굴지만.하루하루가 편하지 않아.지금까지 나를 놓지 말아.사실 네가 그리워.이젠 솔직히 네가보고 싶어. 이 자리로 다시 돌아왔어요.우리가 다시 얘기할 수 있을까.다시 시도해 볼 수 있다.우리 예전처럼 돌아가.또웃을 수 있다면.다시 사랑을 다시 또.다시 사랑을 다시 또.아무일도 없는 것처럼.네게로 다시 돌아왔어요.눈 뜨기 싫은 건 내 옆에 네가 없으니까.내 일상을 지워버린 네가.다시 또 다시 생각나또다시.멈춰지지가 않아.시간을 되돌려 다시 볼 수 있다면. 지쳐가. 이젠 기억속에 갇혀버린 채. 나오지 못해.나올수 없어 왜. 내 맘이텅 비어만 가. 우리가 다시 얘기할 수 있을까.다시 시도해 볼 수 있다.우리가 다시 얘기할 수 있을까.다시 시도해 볼 수 있을까,1,0,5
Can We Talk Again (Inst.),우리는 왜 이러는지.너무이해가 안 돼. 미안하단말 한마디.왜 쉽지 않은지.잘됐어 아니 후회해.자꾸 못된 네가떠나질 않아.지금 분명한 건.자기 생각만 했었지사실 네가 그리워.이젠솔직히 네가 보고싶어.이 자리로 다시 돌아왔어요.우리가 다시 얘기할 수 있을까.다시 시도해 볼 수 있다.우리 예전처럼 돌아가.또웃을 수 있다면.다시 사랑을 다시 또.다시 사랑을 다시 또.아무일도 없는 것처럼.네게로 다시 돌아왔어요.네게로 다시 돌아왔어요.생각보다 더 외로워더 괴로워.네존재가 너무나 컸으니까.미련을버리지 못한 난 이 바보야.너와함께 한 시간.차라리잊어버리고 싶어 You. 별일 아닌 것처럼 또 없던 것처럼.태연하게 굴지만.하루하루가 편하지 않아.지금까지 나를 놓지 말아.사실 네가 그리워.이젠 솔직히 네가보고 싶어. 이 자리로 다시 돌아왔어요.우리가 다시 얘기할 수 있을까.다시 시도해 볼 수 있다.우리 예전처럼 돌아가.또웃을 수 있다면.다시 사랑을 다시 또.다시 사랑을 다시 또.아무일도 없는 것처럼.네게로 다시 돌아왔어요.눈 뜨기 싫은 건 내 옆에 네가 없으니까.내 일상을 지워버린 네가.다시 또 다시 생각나또다시.멈춰지지가 않아.시간을 되돌려 다시 볼 수 있다면. 지쳐가. 이젠 기억속에 갇혀버린 채. 나오지 못해.나올수 없어 왜. 내 맘이텅 비어만 가. 우리가 다시 얘기할 수 있을까.다시 시도해 볼 수 있다.우리가 다시 얘기할 수 있을까.다시 시도해 볼 수 있을까,1,0,5
우린 부족했어,다가온 너의 코 끝이 내 볼을 찌르니. 빨려들던 그 숨내음. 나도 모르게 네 등 뒤를 휘감은 순간. 꿈 속을 헤매는 것 같았어. 더운 공기 스친 호흡 모두 기억해. 꼭 짙게 배인 향수 같았어. 날 집어삼킨 기분 좋은 설렘까지도. 다 운명 같았던 날. 서툴렀던 우린 그저 서로를 사랑했고. 늘 함께 할 수 있을거라 굳게 믿었지. 그래 우린 부족했어. 찢겨진 달력 장 수 만큼 뜨거워졌고. 어쩐지 끓을수록 넘쳤어. 결국 흘러넘친 맘이 탈이 난걸까. 체했나봐 서로에게. 오래 걷다 마주했던 바람 같기도. 어두운 거리 불빛 같기도. 내가 품은 이상을 늘 꿈꾸게 하던. 도무지 현실같지 않았던 때. 서툴렀던 우린 그저 서로를 사랑했고. 늘 함께 할 수 있을거라 굳게 믿었지. 그래 우린 부족했어. 서툴렀던 우린 그저 서로를 사랑했고. 늘 함께 할 수 있을거라 굳게 믿었지. 그래 우린 부족했어. 완벽하진 않았지만 완연한 사랑. 날 채우기엔 충분했는데. 내게만 허락했던 그 더운 품이. 나는 조금 그리워,1,0,2
다른 마음으로 진다,다르게 흘러버린 우리는. 다른 마음으로 지고. 변하지 않을 것 같던 우리도. 결국은 변했네. 낡은 마음 바랜 추억을 되감는 습관. 아직도 하루가 채워지지 않나봐. 그리운 너의 숨은. 그대로 남아 나를 작게 만들어. 유난했던 사랑이 끝나니. 길을 잃은 것만 같아. 멈췄던 시간을 다시 배로 살아야겠지. 언제쯤 너를 덜어낼 수 있을까. 그리운 너의 숨은 그대로 남아. 나를 작게 만들어. 유난했던 사랑이 끝나니. 길을 잃은 것만 같아. 더는 같을 수 없는 맘. 솔직할 수 없는 그리움. 바라는 건 없었는데 함께이면 됐어. 그리운 너의 숨은 그대로 남아. 나를 작게 만들어. 유난했던 사랑이 끝나니. 길을 잃은 것만 같아. 다르게 흘러버린 우리는. 다른 마음으로 지고. 모든 게 변했지만. 난 아직 우리에 멈춰있어,1,0,0
각자의 밤,살을 에우는 익숙함은. 날 막다른 길로 내몰고. 다시 묻지 못하고. 아무말도 하지 못했던. 모두 빈 시간. 그냥 모른 척만이 널 달랠 수 있어서. 내 진심은 숨긴 채. 마치 사랑한 적 없었던 것처럼. 눈을 맞추고. 지나가는 사람 하나 둘. 새다보면 안녕을 나누겠지. 그리고 난 그 때도 웃겠지. 너를 보고 웃겠지. 그저 아닌 척만이 날 지킬 수 있어서. 내 표정은 지우고. 더는 마주할 일 없다는 것처럼. 손을 흔들고. 스쳐가는 사람 셋 넷 새다보면. 내 곁을 떠나겠지. 그러면 난 그 때는 울겠지. 너를 못 봐 울겠지. 뜬 달이 너무 환해서 과히 빛나. 나를 꿰뚫는 것 같아. 그제야 무너져내려. 너의 밤엔 내가 없구나,1,0,1
내가 사랑한 것들이 날 떠났어요,평소와 다를 것 없는 날. 공기마저 어제 같은 날. 똑같은 아침 똑같은 밤인데. 떼던 발걸음도 다 똑같은 무겐데. 맘이 비었어요 자꾸만 내가 멈춰서요. 맘이 안보여요 자꾸만 내가 멈춰서요. 내 속이 텅 비었는데. 이게 혹시 내 탓인가요. 내가 사랑한 몇가지를. 잃은 것 같아요. 영원한 건 왜 없나요. 사랑은 왜 끝나나요. 날 떠났어요. 맘이 비었어요 무언가 날 떠났나봐요. 맘이 안보여요 무언가 날 떠났나봐요. 내 속이 텅 비었는데. 이게 혹시 내 탓인가요. 내가 사랑한 몇가지를. 잃은 것 같아요. 영원한 건 왜 없나요. 사랑은 왜 끝나나요. 날 떠났어요. 사랑했던 바람과 구름. 늘 빛나던 나와 더 빛나던 너. 사진 속 남은 만날 수 없는 모든 것. 자꾸만 흐려지는 맘. 내 기억들 시절들 사람들 그 향기들,1,0,4
혼잣말,안녕 잘 지내나요 거기도 많이 춥죠. 감기 조심해요 아프지 말고. 별일은 없나요 요즘도 많이 힘들죠. 조금만 더 힘을 내요 내가 기도할게. 사실 많이 보고 싶었어요. 이런 말 미안해요. 마음속에 두기엔. 너무 커서 이렇게 말해요. 무슨 생각 해요 너무 당황스럽죠. 미안해요 나도 이럴 줄은 몰랐어요. 사실 많이 좋아해요. 이런 말 미안해요. 후회로 남아버릴까 봐 이렇게 말해요,1,0,1
1010,난가끔씩 니생각 하곤해. 내옆 누구든상관없던 나였는데. 몇일째 너와 듣던 음악 나홀로. 아무렇지 않을꺼라고. 지나갈줄알았어. 언제나 내옆엔 항상 너였는데. 그땐 익숙함에 가려져. 널너무 모르고 지나쳐버린나. 바래져가던 우리 나. 그때로 돌아간다면. 놓지않을텐데 니 두손. 꼭잡고 걸을텐데. 제법 춥던 그날 과분한 사랑 주던. 니모습 자꾸만 떠올라서. 넌가끔씩 내생각 하곤하는지. 니옆 누구든상관없을 나였는데. 몇일째 사진속우리들 나홀로. 변하지 않을꺼라던 너. 돌아올줄 알았어. 사람들은 말해 괜찮을거라고. 다른 누군가그빈자릴. 채워져 잊혀질거라 그런데난. 흩어져가던 우리 나. 그때로 돌아간다면. 얼어붙은 마음 두팔벌려. 꼭안아줄텐데. 헤어진 그날속 멈춰있는. 너와나 이제는 멀어져버린. 바래져가던 우리 나. 그때로 돌아간다면. 놓지않을텐데 니손꼭붙잡고. 잃어버린우리 시간들. 속에서 이렇게 기다릴텐데. 난 미안해 아직,1,0,0
그대는 어디에,모든 게 두려운 나였나 봐. 버릇처럼 뒤를 돌아보죠. 사랑은 앞만 보고 달려도. 나는 가질 수 없었죠. 난 바라죠 그때의 그 날로. 함께였던 그대 앞으로. 뒤를 돌아보면 서 있던. 그저 바라보면 좋았던 우리. 어디 있어도 내게 와 주던. 그대는 어디에. 그대는 지금 어디에. 사랑은 주는 게 더 좋은데. 받기만 했던 나였죠. 난 바라죠 그때의 그 날로. 함께였던 그대 앞으로. 뒤를 돌아보면 서 있던. 그저 바라보면 좋았던 우리. 어디 있어도 내게 와 주던. 그대는 어디에. 그대는 지금 어디에. 같은 마음이면 그대도 아프면. 우리 어떻게든 다시 사랑해야 해. 여기 멈춰서면 와줄까. 계속 걷다 보면 그대 있을까. 내가 힘들 때 날 안아 주던. 그대는 어디에. 그대는 어디에,1,0,2
말이 안 되잖아 (Feat. 헤이즈),달라 보였어. 문득 올려본 그 별들이. 이미 사라진 채로 빛나고 있는 외로움. 달리 불었어. 가슴 가득 품던 바람도. 전부 지나갈 뿐이라고. 여긴 아무것도 없다고. 무슨 말을 할까. 누가 먼저 말할까. 어쩌면 모든 게. 계절 탓은 아닐까. 내가 느끼는 걸 너도 느끼는 걸. 모를리 없는 슬픈 우리. 말이 안 되잖아. 어울리질 않잖아. 우리와 이별을. 한 줄에 쓴다는 게. 깜박이던 별 하나가 보이질 않아. 애틋했던 이름도 체온도 입술도. 별수 없었어. 설렘 뒤의 텅 빈 시간을. 특별하지 못한걸. 인정하기 싫은데. 참 고마웠다고. 말하려다 삼킨 순간들. 끝내기엔 아쉽고. 머물 이유도 없는. 초라한 틈에 선 두 사람. 무슨 말을 할까. 누가 먼저 말할까. 어쩌면 모든 게. 계절 탓은 아닐까. 내가 느끼는 걸 너도 느끼는 걸. 모를리 없는 슬픈 우리. 말이 안 되잖아. 어울리질 않잖아. 우리와 이별을. 한 줄에 쓴다는 게. 깜박이던 별 하나가 보이질 않아. 애틋했던 이름도 체온도 입술도. 결국 서롤 떠올리겠지. 다른 사랑 하기 쉽지 않겠지. 많이 그리워하고. 실컷 울어보기도 하면. 다시 돌아올 수 있을까. 말이 안 되잖아. 어울리질 않잖아. 우리와 이별을. 한 줄에 쓴다는 게. 어쩌면 오래전 끝나버린 얘기. 아무리 애써 이어봐도. 말이 안 되잖아. 설득력이 없잖아. 우리와 이별은. 앞뒤가 안 맞잖아. 헝클어진 발걸음을 맞춰보아도. 멀어져가잖아. 말이 안 되잖아. 빛을 잃은 새벽달은 애써보아도. 사라져가잖아,1,0,5
말이 안 되잖아 (Inst.),달라 보였어. 문득 올려본 그 별들이. 이미 사라진 채로 빛나고 있는 외로움. 달리 불었어. 가슴 가득 품던 바람도. 전부 지나갈 뿐이라고. 여긴 아무것도 없다고. 무슨 말을 할까. 누가 먼저 말할까. 어쩌면 모든 게. 계절 탓은 아닐까. 내가 느끼는 걸 너도 느끼는 걸. 모를리 없는 슬픈 우리. 말이 안 되잖아. 어울리질 않잖아. 우리와 이별을. 한 줄에 쓴다는 게. 깜박이던 별 하나가 보이질 않아. 애틋했던 이름도 체온도 입술도. 별수 없었어. 설렘 뒤의 텅 빈 시간을. 특별하지 못한걸. 인정하기 싫은데. 참 고마웠다고. 말하려다 삼킨 순간들. 끝내기엔 아쉽고. 머물 이유도 없는. 초라한 틈에 선 두 사람. 무슨 말을 할까. 누가 먼저 말할까. 어쩌면 모든 게. 계절 탓은 아닐까. 내가 느끼는 걸 너도 느끼는 걸. 모를리 없는 슬픈 우리. 말이 안 되잖아. 어울리질 않잖아. 우리와 이별을. 한 줄에 쓴다는 게. 깜박이던 별 하나가 보이질 않아. 애틋했던 이름도 체온도 입술도. 결국 서롤 떠올리겠지. 다른 사랑 하기 쉽지 않겠지. 많이 그리워하고. 실컷 울어보기도 하면. 다시 돌아올 수 있을까. 말이 안 되잖아. 어울리질 않잖아. 우리와 이별을. 한 줄에 쓴다는 게. 어쩌면 오래전 끝나버린 얘기. 아무리 애써 이어봐도. 말이 안 되잖아. 설득력이 없잖아. 우리와 이별은. 앞뒤가 안 맞잖아. 헝클어진 발걸음을 맞춰보아도. 멀어져가잖아. 말이 안 되잖아. 빛을 잃은 새벽달은 애써보아도. 사라져가잖아,1,0,5
이별자리,어느새 해는 저물어가고. 하루가 어떻게 지난 건지. 괜스레 초조해지고 복잡한 맘에. 난 다시 혼자가 돼. 오늘은 약속도 없는 날. 갈 곳도 정하지 못했는데. 문득 떠오르는 사람 그게 너라서. 애꿎은 하늘만 본다. 어제와 같은 자리에 난 여기 멈춰서 있어. 오늘도 같은 자리에 하루를 버티고 있어. 혼자 걷는 퇴근길에 추억이 또 밀려와. 우리가 함께 했던 이 곳으로. 무작정 버스를 타고. 어디로 가는 지도 난 모른 체. 옆자릴 바라보다 네가 없단 생각에. 쓸쓸히 창밖을 본다. 어제와 같은 자리에 난 여기 멈춰서 있어. 오늘도 같은 자리에 하루를 버티고 있어. 혼자 걷는 퇴근길에 추억이 또 밀려와. 우리 사랑했던 이 곳으로. 햇살이 내리면 다시 가려진 너의 자리. 잠시라도 널 잊을 수 있었는데. 어두운 발걸음 밤하늘 별빛처럼. 내 맘에 넌 자꾸 떠오르네 여전히 넌. 이젠 같은 자리에 돌아갈 순 없는 거니. 이미 넌 다른 곳으로 날 두고 가버렸잖아. 그리움에 돌고 돌아 다시 널 찾아왔어. 우리가 사랑했던 이별자리,1,0,4
이별자리 (Inst.),어느새 해는 저물어가고. 하루가 어떻게 지난 건지. 괜스레 초조해지고 복잡한 맘에. 난 다시 혼자가 돼. 오늘은 약속도 없는 날. 갈 곳도 정하지 못했는데. 문득 떠오르는 사람 그게 너라서. 애꿎은 하늘만 본다. 어제와 같은 자리에 난 여기 멈춰서 있어. 오늘도 같은 자리에 하루를 버티고 있어. 혼자 걷는 퇴근길에 추억이 또 밀려와. 우리가 함께 했던 이 곳으로. 무작정 버스를 타고. 어디로 가는 지도 난 모른 체. 옆자릴 바라보다 네가 없단 생각에. 쓸쓸히 창밖을 본다. 어제와 같은 자리에 난 여기 멈춰서 있어. 오늘도 같은 자리에 하루를 버티고 있어. 혼자 걷는 퇴근길에 추억이 또 밀려와. 우리 사랑했던 이 곳으로. 햇살이 내리면 다시 가려진 너의 자리. 잠시라도 널 잊을 수 있었는데. 어두운 발걸음 밤하늘 별빛처럼. 내 맘에 넌 자꾸 떠오르네 여전히 넌. 이젠 같은 자리에 돌아갈 순 없는 거니. 이미 넌 다른 곳으로 날 두고 가버렸잖아. 그리움에 돌고 돌아 다시 널 찾아왔어. 우리가 사랑했던 이별자리,1,0,4
