title,lyrics,이별유무,긍부정,cluster_label
너만을 사랑한다 (Inst.),널 죽을 만큼 사랑한다. 다시 없을 사랑인 걸 알기에. 널 영원까지 기다린다. 내 가슴 속 사랑은. 너여야만 하니까. 모든 순간을 널 찾아 헤맨다. 그래야만 살아지는 나라서. 내 곁에 없어도 널 지켜 낼 거야. 못 다한 내 사랑이 서러워도. 그래도 너만을 사랑한다. 미치게 그리워한 너니까. 떠난 후에 더 깊은 사랑을. 뼈저리게 아니까. 그만큼 너만을 사랑한다. 가슴에 오직 너만 사니까. 마지막까지 너만을 위해서. 살아가고 싶다. 모든 순간을 널 찾아 헤맨다. 그래야만 살아지는 나라서. 내 곁에 없어도 널 지켜 낼 거야. 못 다한 내 사랑이 서러워도. 그래도 너만을 사랑한다. 미치게 그리워한 너니까. 떠난 후에 더 깊은 사랑을. 뼈저리게 아니까. 그만큼 너만을 사랑한다. 가슴에 오직 너만 사니까. 마지막까지 너만을 위해서. 살아가고 싶다. 너를 위해 살고 싶다,0,2,
우리 잘 지내고 있는 거지,이제 내 얘길 들어줘. 어떤 말을 할진 몰라. 그저 내 하룰 들어줘. 별건 아니겠지만. 보고싶은 얼굴들과. 아련한 추억까지도. 오늘따라 더 생각이 나. 핸드폰을 열어놓고. 한참을 생각 생각하다. 결국엔 다시 그 자리에. 우리 잘 지내고 있는거지. 나와 모두가 행복하길. 매일 걷고있는 이 길위에. 추억하고 그리워하고 그렇게. 그만 하루가 끝나가. 많은 얘길 못했지만. 내 맘 깊은 곳에 담아. 너에게 편지를 써. 보고싶은 얼굴들과. 아련한 추억까지도. 오늘따라 더 생각이 나. 핸드폰을 열어놓고. 한참을 생각 생각하다. 결국엔 다시 그 자리에. 우리 잘 지내고 있는거지. 나와 모두가 행복하길. 매일 걷고있는 이 길위에. 추억하고 그리워하고 그렇게. 매일 꿈에서 그리던. 그날을 기억해봐. 내가 전하고 싶었던 말. 난 널 잊지않고 생각해. 너와 걷고있는 이 길위에. 노래하고 불러보고 그렇게. 우리 잘 지내고 있는거지. 나와 모두가 행복하길. 매일 살아가는 그 자리에. 사랑하고 또 사랑하고 그렇게,0,2,
우리 잘 지내고 있는 거지 (Inst.),이제 내 얘길 들어줘. 어떤 말을 할진 몰라. 그저 내 하룰 들어줘. 별건 아니겠지만. 보고싶은 얼굴들과. 아련한 추억까지도. 오늘따라 더 생각이 나. 핸드폰을 열어놓고. 한참을 생각 생각하다. 결국엔 다시 그 자리에. 우리 잘 지내고 있는거지. 나와 모두가 행복하길. 매일 걷고있는 이 길위에. 추억하고 그리워하고 그렇게. 그만 하루가 끝나가. 많은 얘길 못했지만. 내 맘 깊은 곳에 담아. 너에게 편지를 써. 보고싶은 얼굴들과. 아련한 추억까지도. 오늘따라 더 생각이 나. 핸드폰을 열어놓고. 한참을 생각 생각하다. 결국엔 다시 그 자리에. 우리 잘 지내고 있는거지. 나와 모두가 행복하길. 매일 걷고있는 이 길위에. 추억하고 그리워하고 그렇게. 매일 꿈에서 그리던. 그날을 기억해봐. 내가 전하고 싶었던 말. 난 널 잊지않고 생각해. 너와 걷고있는 이 길위에. 노래하고 불러보고 그렇게. 우리 잘 지내고 있는거지. 나와 모두가 행복하길. 매일 살아가는 그 자리에. 사랑하고 또 사랑하고 그렇게,0,2,
끝없이 가라앉아 멀어져만 가네,누구에게도 사랑받지 못하고. 떠도는 모습이 우스워져. 기다림의 시간들은. 어둠이 되어 내려앉고. 난 끝없이 가라앉아 멀어져만 가네. 혼자 남은 사랑들을. 끌어안고 놓지 못해. 쏟아져 내린 바람들. 흘러가는 기억의 끝에서. 떨어지지 않으려 몸부림쳐. 기다림의 시간들은. 어둠이 되어 내려앉고. 난 끝없이 가라앉아 멀어져만 가네. 혼자 남은 사랑들을. 끌어안고 놓지 못해. 쏟아져 내린 바람들. 쏟아져 내린 바람들,0,2,
파동,우리는 모두 끝인 것 같은. 시간의 절벽에 매달려. 굴러 떨어져도 아무도 모를. 환상 같은 미래를 휘저으며. 수면 위를 걷듯 발끝까지 힘을 주고. 툭 하고 떨어지는. 감추려 했던 마음들은. 꼭 나를 비집고 나와. 내 작은방을 무너뜨리고. 울렁이는 밤 위를 떠도는. 종이배를 타고 노래를 불러. 안개가 자욱한 생각의 수평선. 그 끝에 걸터앉아. 이정표를 잃은 수많은 낮과. 밤들은 어디로 가는지. 사라질 듯 한껏 흔들리는 영혼 같은. 툭 하고 떨어지는. 감추려 했던 마음들은. 꼭 나를 비집고 나와. 내 작은방을 무너뜨리고. 울렁이는 밤 위를 떠도는. 종이배를 타고 노래를 불러,0,2,
끝없이 가라앉아 멀어져만 가네 (Inst.),누구에게도 사랑받지 못하고. 떠도는 모습이 우스워져. 기다림의 시간들은. 어둠이 되어 내려앉고. 난 끝없이 가라앉아 멀어져만 가네. 혼자 남은 사랑들을. 끌어안고 놓지 못해. 쏟아져 내린 바람들. 흘러가는 기억의 끝에서. 떨어지지 않으려 몸부림쳐. 기다림의 시간들은. 어둠이 되어 내려앉고. 난 끝없이 가라앉아 멀어져만 가네. 혼자 남은 사랑들을. 끌어안고 놓지 못해. 쏟아져 내린 바람들. 쏟아져 내린 바람들,0,2,
하이틴 스타,영원할 것 같던 스타는. 추억 속 화면으로 잊혀지고. 뉴스가 뉴스를 덮듯. 그렇게 또 사라지겠지. 바다의 파도 거품처럼. 사라질 걸 알았던가. 영원한 것이 있다면. 그것에 마음을 쏟았을 텐데. 매일 뜨고 지는 하루해를 보며. 내 맘에 담는다. 오늘을 마지막처럼 살아가길. 또 사랑하길. 영원할 것 같던 스타는. 기억 속 어딘가로 잊혀지고. 흘러간 노래들처럼. 가끔씩 꺼내 부르겠지. 나무의 하얀 꽃잎처럼. 떨어질 걸 알았던가. 영원한 것이 있다면. 그것에 시간을 쏟았을 텐데. 매일 뜨고 지는 하루해를 보며. 내 맘에 담는다. 오늘을 마지막처럼 살아가길. 또 사랑하길. 매일 뜨고 지는 하루해를 보며. 내 맘에 담는다. 오 오늘을 마지막처럼 살아가길. 또 사랑하길,0,2,
내게 말해줘요,내게 위로를 해요. 괜찮다 말해요. 오늘 참 내가 두려워서. 괜찮다 말해요. 나를 토닥여도 봐요. 곧 끝날 거라고. 오늘 참 내가 힘들어서. 눈물이 나네요. 오늘은 좀 듣고 싶네요. 넌 잘하고 있다고. 그렇게만 하라고. 조금 더 견디라고. 늘 기도한다고. 니 마음 안다고. 가보지 않은 이 길 끝에서 넌. 웃을 수 있다고. 나를 토닥여도 봐요. 곧 끝날 거라고. 오늘 참 내가 힘들어서. 눈물이 나네요. 오늘은 좀 듣고 싶네요. 넌 잘하고 있다고. 그렇게만 하라고. 조금 더 견디라고. 늘 기도한다고. 니 마음 안다고. 가보지 않은 이 길 끝에서 넌. 웃을 수 있다고. 오늘은 좀 듣고 싶네요. 듣고 싶네요. 넌 잘하고 있다고. 잘하고 있다고. 그렇게만 하라고. 조금 더 견디라고. 늘 기도한다고. 니 마음 안다고. 가보지 않은 이 길 끝에서 넌. 웃을 수 있다고. 웃을 수 있다고. 곧 끝날 거라고,0,2,
이대로가 좋아 (feat. 혜선),이대로가 좋아. 이대로도 좋아. 너와 있으면 난. 같이 있으면 난. 편해서 좋아. 설레어서 좋아. 그냥 이렇게. 이대로가 좋아. 이대로도 좋아. 오래된 너와 난. 특별한 너와 난. 편해서 좋아. 설레어서 좋아. 그냥 이렇게. 고백하면. 멀어질 걸 아니까. 애써 맘을 감추며 만난. 지난 시간 우리 잘 지내왔지. 남자와 여잔. 친구가 안된다니. 우리는 다르지 어느덧. 함께한 10년의 시간. 밥 먹고 후식에. 영화도 보고 집에도 놀러 가고. 오래된 연인처럼. 우린 서로의 곁에. 이대로가 좋아. 이대로도 좋아. 너와 있으면 난. 같이 있으면 난. 편해서 좋아. 설레어서 좋아. 그냥 이렇게. 이대로가 좋아. 이대로도 좋아. 오래된 너와 난. 특별한 너와 난. 편해서 좋아. 설레어서 좋아. 그냥 이렇게. 이대로가 좋아. 이대로도 좋아. 그냥 이렇게,0,2,
정말 축하해요,정말 축하해요. 둘이 참 잘 어울려요. 날씨도 좋아서. 결혼하기 좋은 날이에요. 오늘의 주인공. 가장 눈부신 너. 지금처럼 영원히 빛나길. 우리 잘살 거예요. 모두가 준 맘. 그 마음 간직하며. 매일을 살게요. 오래 기다린 만큼. 준비했던 만큼. 우린 행복할 거예요. 고마워요. 오늘의 주인공. 가장 눈부신 너. 지금처럼 영원히 빛나길. 우리 잘살 거예요. 모두가 준 맘. 그 마음 간직하며. 매일을 살게요. 오래 기다린 만큼. 준비했던 만큼. 우린 행복할 거예요. 고마워요. 우리 잘살 거예요. 모두가 준 맘. 그 마음 간직하며. 매일을 살게요. 오래 기다린 만큼. 준비했던 만큼. 우린 행복할 거예요. 고마워요. 우린 잊지 않을게요. 고마워요,0,2,
이상하다,이상하다. 내 핸드폰 어디로 갔나. 내 지갑은 어디로 갔나. 이상하다. 내 잠옷은 어디로 갔나. 머리끈은 어디로 갔나. 어디로 갔나. 내 건 도대체 다 어디로 가는 거야. 분명 여기쯤 뒀는데. 집중력 좋아 동시에 두 갠 못해. 오빠가 필요해. 이상하다. 잘 때 폰 충전한 거 같은데. 왜 밧데리는 없는 걸까. 정말 이상하다. 내 건 도대체 다 어디로 가는 거야. 분명 여기쯤 뒀는데. 집중력 좋아 동시에 두 갠 못해. 오빠가 필요해. 이상하다. 아이롱 전원은 껐던가. 차는 지하 몇 층에 뒀나. 이상하다. 이 택배는 언제 시켰나. 도대체가 기억이 안 나. 두루루루 두루루루 루루루루루. 두루루루 루루루루루. 오빠가 필요해 오빠가 필요해. 오빠가 필요해,0,2,
넌 하얀색,널 바라보면. 가슴이 벅차. 내 맘을 보는 넌. 너무나 예뻐. 작은 손으로. 내 손등에 쓴 세 글자. 사랑해 사랑해. 넌 하얀색. 혼자 있어도 예쁘고. 같이 있어도 날 밝혀주는. 넌 하얀색. 니 맘속에. 무엇이든 그려보렴. 너의 아름다운 세상에서. 맘껏 웃기를. 작은 손으로. 내 손등에 쓴 세 글자. 사랑해 사랑해. 넌 하얀색. 혼자 있어도 예쁘고. 같이 있어도 날 밝혀주는. 넌 하얀색. 니 맘속에. 무엇이든 그려보렴. 너의 아름다운 세상에서. 맘껏 웃기를. 혼자 있어도 예쁘고. 같이 있어도 날 밝혀주는. 넌 하얀색. 니 맘속에. 무엇이든 그려보렴. 너의 아름다운 세상에서. 맘껏 웃기를,0,2,
여기 우리 (With 제이레빗),삶의 무게에 지쳐있는 너. 잘못된 선택에 아파하고 있을 때. 그저 옆에 있는 것 말곤. 할 수 있는 게 없어서. 조심스레 내 맘 적어 보내요. 추운 겨울 길이면 어때. 서로의 온기가 있는 걸. 내리막길이어도 어때. 함께 걷는 우리가 있는 걸. 세상은 차갑고 시끄럽지만. 우린 꽃을 피울 바람의 소릴 듣자. 여기 우리 함께 있다면. 삶의 무게에 지쳐있는 너. 잘못된 선택에 아파하고 있을 때. 그저 옆에 있는 것 말곤. 할 수 있는 게 없어서. 조심스레 내 맘 적어 보내요. 추운 겨울 길이면 어때. 서로의 온기가 있는 걸. 내리막길이어도 어때. 함께 걷는 우리가 있는 걸. 세상은 차갑고 시끄럽지만. 우린 꽃을 피울 바람의 소릴 듣자. 여기 우리. 추운 겨울 길이면 어때. 서로의 온기가 있는 걸. 내리막길이어도 어때. 함께 걷는 우리가 있는 걸. 세상이 어두워 길을 잃어도. 우린 저기 떠오르는 별을 바라보자. 여기 우리. 여기 우리 음. 여기 우리 함께 있다면,0,2,
밤이니까 무시하자,꼭 밤만 되면 올라오더라. 아까까진 괜찮았었는데. 이 밤이 길어지려 해. 내일 일찍 나가야 되는데. 애써 누우며 나에게 말했지. 가슴 뛰는 나에게 말했지. 밤이니까 무시하자. 내일이면 또 괜찮아질 거야. 이 밤의 설움도. 아침이면 씻겨져 가겠지. 밤이니까 무시하자. 내일이면 또 별일 아닐 거야. 한껏 예민해 울었던. 이 밤이 지나면 내가 왜 그랬는지. 무안해질 거야 그냥 빨리 자자. 다 때가 되면 사라지더라. 그렇게나 아파하던 것도. 끝이 있는 걸 아니까. 그 마지막이 오늘일 거라고. 아무 일 없었던 것처럼. 그래 별일 아닌 것처럼. 밤이니까 무시하자. 내일이면 또 괜찮아질 거야. 이 밤의 설움도. 아침이면 씻겨져 가겠지. 밤이니까 무시하자. 내일이면 또 별일 아닐 거야. 한껏 예민해 울었던. 이 밤이 지나면 내가 왜 그랬는지. 무안해질 거야 그냥 빨리 자자. 밤이니까 밤이니까. 무시하자 무시하자. 내일이면 내일이면 괜찮아질 거야. 이 밤의 설움도 설움도. 아침이면 씻겨져 가겠지. 밤이니까 우 무시하자. 내일이면 또 별일 아닐 거야. 한껏 예민해 울었던. 이 밤이 지나면 내가 왜 그랬는지. 무안해질 거야 그냥 빨리 자자. 음 그냥 빨리 자자,0,2,
함께 부르자,노래하는 게 젤 좋았던 작은 아이. 노래 부를 때 가장 행복했네. 노래 없인 안 됐고 노래밖에 몰랐네. 그 행복한 모습에 그 맑은소리에. 사람들도 행복했네. 그 노래가 세상을 밝게 했네. 어느 날 아이에게 찾아온 아픔. 그 무언가가 목소릴 앗아갔네. 위축되고 작아진 목소리. 기쁨이었던 노래가. 이제는 고통 되었네. 목소리만 아니라. 그 웃음도 앗아갔네 앗아갔네. 사람들 모르게 숨어도 보았네. 난 아무렇지 않다며. 노래 아닌 다른 꿈도 꾸었네. 내가 같이 노래할 게 힘이 돼줄게. 이전 같지는 않아도 함께 불러보자. 넌 그 자체로 기쁨이니 넌 행복이니. 다시 노래한다면 그것만으로 충분해. 같이 노래할 게 힘이 돼줄게. 이전 같지는 않아도 함께 불러보자. 내가 같이 노래할 게 힘이 돼줄게. 이전 같지는 않아도 함께 불러보자. 넌 그 자체로 기쁨이니 넌 행복이니. 다시 노래한다면 그것만으로 충분해. 나나나나 나나나나 나나나나나. 나나나 나나나나나 나나나나나. 나나나나 나나나나 나나나나나. 오 나의 작은 사랑아. 우리 함께 부르자,0,2,
우리의 노래가 (feat. 혜선),꾹꾹 담아 만든 노래들. 한 사람이어도 이 노랠 듣는다면. 뻔한 얘기여도 그 말이 필요한. 사람에게 닿는다면 우린 부를게요. 우리의 노래가. 마음에 울리길. 듣는 사람들에게도. 부르는 우리도. 가슴속 작은 빛 되길. 우리의 노래가. 들리지 않아도. 너의 추억 속에 남아. 들려지기를 꺼내 볼 수 있길. 그 웃음처럼 맑은 날에도. 혼자 남은 듯한 시립고 어두운 날도. 함께 울고 웃던 잠시 기대어 쉬던. 그 노래들이 우릴 빛나게 하죠. 우리의 노래가. 마음에 울리길. 듣는 사람들에게도. 부르는 우리도. 가슴속 작은 빛 되길. 우리의 노래가. 들리지 않아도. 너의 추억 속에 남아. 들려지기를 꺼내 볼 수 있길. 이 노래 들을 때. 어디서든 부를 때. 우린 함께 있죠. 우리의 노래가. 마음에 울리길. 듣는 사람들에게도. 부르는 우리도. 가슴속 작은 빛 되길. 우리 바램 모여서. 세상에 울리길. 아름답고 좋은 것만. 사랑하고 아껴주던 그 맘. 그 맘 전해지기를,0,2,
이런 난 어떠니,참 이상한 일야. 나는 하루 종일 너만 봐. 이런 내가 미친 건 아닐까. 생각해 보다 웃곤해. 참 신기한 일야 넌 내 맘에. 노크도 없이 불쑥 들어와. 쿵쿵 뛰어다니며 날 흔들어 놓곤해. 그런 너에게 헤어 나오지 못하는 날. 혹시 가둬둘 너의 맘속에. 방을 내어줄래 내어줄래. 이런 난 어떠니. 참 신나는 일야. 그저 너라서 난 좋은 걸. 어떤 이유도 없어 언제나. 내 맘을 뛰게 만들어. 그대는 내게 예고편도 없는 영화처럼. 어느 날 문득 마주했던. 소나기처럼 왔어. 그런 너에게 헤어 나오지 못하는 날. 혹시 가둬둘 너의 맘속에. 방을 내어줄래. 너의 맘속에 날. 혹시 가둬둘 너의 맘속에. 방을 내어줄래. 내어줄래. 이런 난 어떠니. 이런 난 어떠니 그런 네가 좋아. 라라라 라라라라 라라. 라라 라라라라라 라라라,0,2,
우연히 피어나,천천히. 조금 멀리.느린 나의 걸음이.너의 뒤를 따라가. 어떻게. 말을 걸까.점점 떨려오는 맘이. 내 눈앞을 가리죠.매일 밤마다.간절히바랐던 그 밤에.아무도 모르게.우연히 피어나.너에게 번져 가. 젖어 버린그 날의 꽃잎처럼.더 아름답게.사랑을 만들죠.내 옆에. 있어 주기를.조금씩 더 가까이 내 맘속 느껴지는.가득 품은 설레임.매일 밤마다.간절히바랐던 그 밤에.아무도 모르게.우연히 피어나.너에게 번져 가. 젖어 버린그 날의 꽃잎처럼.더 아름답게.사랑을 만들죠.내 옆에. 있어 주기를.물들어 버린 나처럼.그대 정말 내사랑인 거죠.우연히 피어나.나에게 번져서.쏟아지는그 밤의 별빛처럼.더 아름답게.사랑을 만들죠.내 옆에. 있어 주기를.내 옆에. 네가 있기를,0,2,
하얀 나비,새하얀 나비가 되어.너에게 가고 있어. 그순간을 꿈꿔왔었죠.어느 날 깨어난 작은 나의 곁에.네가 있어 참고마웠던 거야.깊은잠 속에서 깨워준.꿈결과도 같은 푸른빛이.우리를 아름답게 물들이고.다시새로운 꿈을 꾸네.네 곁에 있을 거다힘든 날을 네가비춰줄 때. 새하얀 나비가되어 너와.너에게 날아갈 것이다.너의 따듯한 온기가빛이 되어. 내 맘을 감싸주네 우리는 날아간다.영원히라.너무 행복한 날에도.공허한 눈물이 비쳐.마음한켠에 차가운 바람이.너의 힘들었던 하루가.다지나 가기 전에.네게다가가 사랑을 말할게.가끔은 슬퍼지고 아픔에울어도 보고.가끔은 힘이 들고.마음속깊은 짙은 고독. 너하나만 있어준다면.그 어디라도 우린 함께 갈 수 있어.네 곁에 있을 거다힘든 날을 네가비춰줄 때. 새하얀 나비가되어 너와.너에게 날아갈 것이다.너의 따듯한 온기가빛이 되어. 내 맘을 감싸주네 우리는 날아간다.영원히라.깊은잠 속에서 깨워준.꿈결과도 같은 푸른빛이.우리를 아름답게 물들이고.다시새로운 꿈을 꾸네.네 곁에 있을 거다힘든 날을 네가비춰줄 때. 새하얀 나비가되어 너와.너에게 날아갈 것이다.너의 따듯한 온기가빛이 되어. 내 맘을 감싸주네 우리는 날아간다.영원히다 너,0,2,
들꽃이었더니,눈 내리는 하얀 길을 걸어가죠. 한 걸음 발자욱이 쌓여만 가네요. 꽃들이 흐드러지게 피면. 외로움 덜 할까. 차가운 바람의 봄을 기다려요. 그 누구가 알아줄까요. 우리 모두 이름 없는. 들꽃이었더니 그늘 깊은 땅속. 젖은 발 내리고픈 들꽃이었더니. 가슴 아픈 순간 혼자였었지만. 그대도 나도 이젠 함께할 수 있죠. 미안해요 추운 겨울 속 그대. 손잡지 못해서. 이제는 내가 그댈 꽉 안아 줄게요. 그 누구가 알아줄까요. 우리 모두 이름 없는. 들꽃이었더니 그늘 깊은 땅속. 젖은 발 내리고픈 들꽃이었더니. 그 누구가 알아줄까요. 우리 모두 이름 없는. 들꽃이었더니 그늘 깊은 땅속. 젖은 발 내리고픈 들꽃이었더니. 모두 이름 없는 들꽃이었더니,0,2,
Fall in You,용기가나지 않아서 그래.혹시너에게 부담일까 봐. 매번 마음졸이며 그대를.사랑하고 있어 나. 타다나이제야 알게 됐죠.당신에 빠지다널 기다리고 있어요.당신에 빠지다그댄 내 운명이죠.나의별이 되어줄 한사람.내 모든 걸주고픈 한사람. 그대. 그대. 그대생각에 빠져살아요.혹시 내 맘을알아줄까 봐. 항상 가까운곳에 있는 날. 이젠알아봐 주세요.당신에 빠지다나이제야 알게 됐죠.당신에 빠지다널 기다리고 있어요.당신에 빠지다그댄 내 운명이죠.나의별이 되어줄 한사람.제가너무 늦진 않았나요.상처받을까 봐. 내가 겁이났나 봐요.처음이라서 이제야 깨달았죠.그대가나의 사랑이란 걸. 타다나이제야 알게 됐죠.당신에 빠지다널 기다리고 있어요.당신에 빠지다그댄 내 운명이죠.나의별이 되어줄 한사람.내 모든 걸주고픈 한사람.그대,0,2,
그런 내 사람,소중하단 말이 그리워. 난 누군가의 사람. 슬플 때 위로해주는. 그런 내 사람. 잊을 수 없는 약속들. 다 지켜주는. 나랑 밥을 같이 먹으면. 얼마나 좋아. 이 세상 혼자 나만 너무 혼자. 난 서러운 사람 되기 싫어. 잘못했지만 날 봐주는 사람. 그런 널 원하면 안 될까. 같이 걷던 길이 흐려져. 더 보이지도 않고. 모든 걸 다 지켜 준다던. 너는 어디에. 이 세상 혼자 나만 너무 혼자. 난 서러운 사람 되기 싫어. 잘못했지만 날 봐준 사람. 그런 널 원하면 안 될까. 소중하단 말이 그리워. 난 누군가의 사람. 슬플 때 위로해주는. 그런 내 사람,0,2,
희망,앞이 보이지 않아. 매일 캄캄한 어둠. 오늘도 해는 뜨지만 음. 언제쯤 내게도 찾아올까. 밝게 빛나는 그 순간. 내가 어디로 가고 있는지. 나조차 모르지만. 내가 선택한 나의 길을 가는거야. 아무 걱정하지마 오. 알수가 없고 불안하지만. 내 삶의 주인은 나야. 내가 선택한 나의 길을 가는거야. 아무 걱정하지마 오. 알수가 없고 불안하지만. 내 삶의 주인은 나야 오. 지금 내 앞이 바로 나의 길이야. 아무런 걱정하지마 오. 날개 활짝 펴고 이제 날자. 날개 활짝 펴고,0,2,
희망 (inst.),앞이 보이지 않아. 매일 캄캄한 어둠. 오늘도 해는 뜨지만 음. 언제쯤 내게도 찾아올까. 밝게 빛나는 그 순간. 내가 어디로 가고 있는지. 나조차 모르지만. 내가 선택한 나의 길을 가는거야. 아무 걱정하지마 오. 알수가 없고 불안하지만. 내 삶의 주인은 나야. 내가 선택한 나의 길을 가는거야. 아무 걱정하지마 오. 알수가 없고 불안하지만. 내 삶의 주인은 나야 오. 지금 내 앞이 바로 나의 길이야. 아무런 걱정하지마 오. 날개 활짝 펴고 이제 날자. 날개 활짝 펴고,0,2,
살랑살랑,사랑 사랑두근 두근대.내맘이 설레 자꾸.너무 떨리는 기분정말 싫은데.계속 보다가 너만사실 온종일.나하루가 다 가. 조금 달라진것 같아.어제보다 쑥스러워 널못 보겠어.살랑살랑꽃이 피어나듯이 너. 내 맘에하나 둘 피어나.맘 온통 어지럽혀.사랑스럽게 보이고 싶어.어떻게 하면 될까. 니 맘에 부는 바람이 되고 싶어.사랑 사랑흔들고 싶어 맘을 니.사랑 사랑.지금은 무슨 생각해.그냥다 궁금해 니가 오 어떡해 나. 살랑살랑 꽃이피어나듯이 너. 내 맘에하나 둘 피어나.맘 온통 어지럽혀.사랑스럽게 보이고 싶어.어떻게 하면 될까. 니 맘에부는 바람이.내가 왜 이럴까 밤을 또 샜나 봐. 오늘꼭 말할래.니 얼굴을 보고나의 마음을.또 바보처럼 굴까겁이 나. 살랑살랑 꽃이피어나듯이 너. 내 맘에하나 둘 피어나.맘 온통 어지럽혀.사랑스럽게 보이고 싶어.어떻게 하면 될까. 니 맘에 부는 바람이 되고 싶어.사랑 사랑흔들고 싶어 맘을 니.사랑 사랑.사랑 사랑흔들고 싶어 맘을 니.사랑 사랑,0,2,
